CONCEPT_ID,CONCEPT_NAME,CONCEPT_CLASS_ID,CONCEPT_VOCAB_ID
44830108,Chronic tonsillitis and adenoiditis,4-dig nonbill code,ICD9CM
45533547,Chronic tonsillitis,5-char billing code,ICD10CM
45576948,Chronic tonsillitis and adenoiditis,5-char billing code,ICD10CM
40316078,Chronic tonsillitis,Disorder,SNOMED
44826665,Chronic tonsillitis and adenoiditis,5-dig billing code,ICD9CM
23220,Chronic tonsillitis,Disorder,SNOMED
44820882,Chronic tonsillitis,5-dig billing code,ICD9CM
1569480,Chronic tonsillitis and adenoiditis,4-char nonbill code,ICD10CM
40395054,(Chronic tonsillitis) or (chronic adenoiditis),Disorder,SNOMED
24978,Chronic adenotonsillitis,Disorder,SNOMED
4110363,Acute tonsillitis NOS,Disorder,SNOMED
44799647,[X]Acute tonsillitis due to other specified organisms,Disorder,SNOMED
4109898,Acute gangrenous tonsillitis,Disorder,SNOMED
4109897,Acute catarrhal tonsillitis,Disorder,SNOMED
4109896,Acute ulcerative tonsillitis,Disorder,SNOMED
40396923,[X]Acute tonsillitis due to other specified organisms,Disorder,SNOMED
4112009,Acute erythematous tonsillitis,Disorder,SNOMED
40316049,Acute tonsillitis,Disorder,SNOMED
1569450,Acute tonsillitis due to other specified organisms,4-char nonbill code,ICD10CM
45538473,Acute tonsillitis, unspecified,5-char billing code,ICD10CM
45605880,Acute recurrent tonsillitis due to other specified organisms,5-char billing code,ICD10CM
1569448,Acute tonsillitis,3-char nonbill code,ICD10CM
40394587,Tonsillitis (& acute),Disorder,SNOMED
24660,Acute tonsillitis,Disorder,SNOMED
40510246,Infective tonsillitis,Disorder,SNOMED
1569451,Acute tonsillitis, unspecified,4-char nonbill code,ICD10CM
45591539,Acute tonsillitis due to other specified organisms,5-char billing code,ICD10CM
4110362,Recurrent acute tonsillitis,Disorder,SNOMED
4110361,Acute viral tonsillitis,Disorder,SNOMED
4112345,Acute bacterial tonsillitis,Disorder,SNOMED
44821975,Acute tonsillitis,3-dig billing code,ICD9CM
40316081,Chronic adenotonsillitis,Disorder,SNOMED
26060,Benign neoplasm of tonsil,Disorder,SNOMED
40387164,Benign tumor of tonsil,Disorder,SNOMED
40541841,Benign tumor of faucial tonsil,Disorder,SNOMED
35206501,Benign neoplasm of tonsil,4-char billing code,ICD10CM
44833347,Benign neoplasm of tonsil,4-dig billing code,ICD9CM
40316080,(Hypertrophy of adenoid &/or tonsils) or (chronic adenoid disease),Disorder,SNOMED
31598,Hypertrophy of tonsils AND adenoids,Disorder,SNOMED
40345746,(Hypertrophy of adenoid &/or tonsils) or (chronic adenoid disease),Disorder,SNOMED
4239899,Size of tonsil,Observable Entity,SNOMED
28457,Hypertrophy of tonsils,Disorder,SNOMED
35207992,Hypertrophy of tonsils,4-char billing code,ICD10CM
44827817,Hypertrophy of tonsils alone,5-dig billing code,ICD9CM
1567469,Malignant neoplasm of tonsil,3-char nonbill code,ICD10CM
40650440,Primary malignant neoplasm of tonsil,Disorder,SNOMED
37018947,Primary squamous cell carcinoma of palatine tonsil,Disorder,SNOMED
37166307,Primary tonsil carcinoma,Disorder,SNOMED
31509,Primary malignant neoplasm of tonsil,Disorder,SNOMED
44827545,Malignant neoplasm of tonsil,4-dig billing code,ICD9CM
35206087,Malignant neoplasm of tonsil, unspecified,4-char billing code,ICD10CM
44825462,Hypertrophy of tonsils and adenoids,4-dig nonbill code,ICD9CM
44832415,Hypertrophy of tonsil with adenoids,5-dig billing code,ICD9CM
45548248,Felty's syndrome, unspecified elbow,6-char billing code,ICD10CM
45586833,Felty's syndrome, unspecified site,5-char billing code,ICD10CM
44821123,Felty's syndrome,4-dig billing code,ICD9CM
45572326,Felty's syndrome, left knee,6-char billing code,ICD10CM
45577092,Felty's syndrome, multiple sites,5-char billing code,ICD10CM
1569968,Felty's syndrome, shoulder,5-char nonbill code,ICD10CM
45538622,Felty's syndrome, unspecified wrist,6-char billing code,ICD10CM
1569974,Felty's syndrome, ankle and foot,5-char nonbill code,ICD10CM
45548252,Felty's syndrome, left ankle and foot,6-char billing code,ICD10CM
45567404,Felty's syndrome, left wrist,6-char billing code,ICD10CM
45591685,Felty's syndrome, right hip,6-char billing code,ICD10CM
1569969,Felty's syndrome, elbow,5-char nonbill code,ICD10CM
45533690,Felty's syndrome, right ankle and foot,6-char billing code,ICD10CM
45567403,Felty's syndrome, unspecified shoulder,6-char billing code,ICD10CM
45543428,Felty's syndrome, unspecified hip,6-char billing code,ICD10CM
1569973,Felty's syndrome, knee,5-char nonbill code,ICD10CM
1569971,Felty's syndrome, hand,5-char nonbill code,ICD10CM
45562581,Felty's syndrome, left elbow,6-char billing code,ICD10CM
45548251,Felty's syndrome, right knee,6-char billing code,ICD10CM
45553036,Felty's syndrome, unspecified ankle and foot,6-char billing code,ICD10CM
45606039,Felty's syndrome, right shoulder,6-char billing code,ICD10CM
4298431,White blood cell count,Procedure,SNOMED
40320314,Felty's syndrome,Disorder,SNOMED
1569970,Felty's syndrome, wrist,5-char nonbill code,ICD10CM
45557752,Felty's syndrome, right elbow,6-char billing code,ICD10CM
45548250,Felty's syndrome, left hand,6-char billing code,ICD10CM
1569972,Felty's syndrome, hip,5-char nonbill code,ICD10CM
45582002,Felty's syndrome, right wrist,6-char billing code,ICD10CM
45567405,Felty's syndrome, unspecified hand,6-char billing code,ICD10CM
1569967,Felty's syndrome,4-char nonbill code,ICD10CM
45548249,Felty's syndrome, right hand,6-char billing code,ICD10CM
81097,Felty's syndrome,Disorder,SNOMED
45577090,Felty's syndrome, left hip,6-char billing code,ICD10CM
45577091,Felty's syndrome, unspecified knee,6-char billing code,ICD10CM
45533689,Felty's syndrome, left shoulder,6-char billing code,ICD10CM
37160421,Felty syndrome with seronegative rheumatoid arthritis,Disorder,SNOMED
45582327,Other chronic osteomyelitis, right hand,6-char billing code,ICD10CM
46270433,Chronic osteomyelitis of hand with draining sinus,Disorder,SNOMED
36685047,Chronic osteomyelitis of left hand,Disorder,SNOMED
45553368,Other chronic hematogenous osteomyelitis, unspecified hand,6-char billing code,ICD10CM
132414,Chronic osteomyelitis of hand,Disorder,SNOMED
44833858,Chronic osteomyelitis, hand,5-dig billing code,ICD9CM
45606422,Other chronic hematogenous osteomyelitis, right hand,6-char billing code,ICD10CM
1571238,Other chronic osteomyelitis, hand,5-char nonbill code,ICD10CM
40321403,Chronic osteomyelitis of the hand,Disorder,SNOMED
36685046,Chronic osteomyelitis of right hand,Disorder,SNOMED
45534032,Chronic multifocal osteomyelitis, unspecified hand,6-char billing code,ICD10CM
1571214,Chronic multifocal osteomyelitis, hand,5-char nonbill code,ICD10CM
45577454,Other chronic osteomyelitis, unspecified hand,6-char billing code,ICD10CM
45577453,Other chronic osteomyelitis, left hand,6-char billing code,ICD10CM
40406032,Chronic osteomyelitis of the hand,Disorder,SNOMED
1571230,Other chronic hematogenous osteomyelitis, hand,5-char nonbill code,ICD10CM
45587176,Other chronic hematogenous osteomyelitis, left hand,6-char billing code,ICD10CM
45596778,Chronic multifocal osteomyelitis, left hand,6-char billing code,ICD10CM
45567759,Chronic multifocal osteomyelitis, right hand,6-char billing code,ICD10CM
132570,Leukemic reticuloendotheliosis of lymph nodes of head, face and neck,Disorder,SNOMED
44832151,Leukemic reticuloendotheliosis, lymph nodes of head, face, and neck,5-dig billing code,ICD9CM
45595721,Chronic myeloid leukemia, BCR/ABL-positive, in remission,5-char billing code,ICD10CM
132572,Chronic myeloid leukemia in remission,Disorder,SNOMED
44832157,Chronic myeloid leukemia, in remission,5-dig billing code,ICD9CM
132643,Orbital osteomyelitis,Disorder,SNOMED
45557309,Osteomyelitis of left orbit,6-char billing code,ICD10CM
1568505,Osteomyelitis of orbit,5-char nonbill code,ICD10CM
37174069,Osteomyelitis of orbit of left eye,Disorder,SNOMED
44825402,Orbital osteomyelitis,5-dig billing code,ICD9CM
45542954,Osteomyelitis of bilateral orbits,6-char billing code,ICD10CM
45557308,Osteomyelitis of right orbit,6-char billing code,ICD10CM
45538188,Osteomyelitis of unspecified orbit,6-char billing code,ICD10CM
37174070,Osteomyelitis of orbit of right eye,Disorder,SNOMED
40321400,Chronic osteomyelitis of the shoulder region,Disorder,SNOMED
45562944,Other chronic osteomyelitis, left shoulder,6-char billing code,ICD10CM
46270396,Chronic osteomyelitis of shoulder with draining sinus,Disorder,SNOMED
45606418,Chronic multifocal osteomyelitis, right shoulder,6-char billing code,ICD10CM
45562945,Other chronic osteomyelitis, unspecified shoulder,6-char billing code,ICD10CM
132718,Chronic osteomyelitis of shoulder,Disorder,SNOMED
45587170,Chronic multifocal osteomyelitis, unspecified shoulder,6-char billing code,ICD10CM
1571235,Other chronic osteomyelitis, shoulder,5-char nonbill code,ICD10CM
45601644,Other chronic osteomyelitis, right shoulder,6-char billing code,ICD10CM
45534037,Other chronic hematogenous osteomyelitis, unspecified shoulder,6-char billing code,ICD10CM
762222,Draining sinus co-occurrent and due to chronic osteomyelitis of left shoulder,Disorder,SNOMED
762227,Draining sinus co-occurrent and due to chronic osteomyelitis of right shoulder,Disorder,SNOMED
45587174,Other chronic hematogenous osteomyelitis, right shoulder,6-char billing code,ICD10CM
45582324,Other chronic hematogenous osteomyelitis, left shoulder,6-char billing code,ICD10CM
1571211,Chronic multifocal osteomyelitis, shoulder,5-char nonbill code,ICD10CM
1571227,Other chronic hematogenous osteomyelitis, shoulder,5-char nonbill code,ICD10CM
44825722,Chronic osteomyelitis, shoulder region,5-dig billing code,ICD9CM
45553362,Chronic multifocal osteomyelitis, left shoulder,6-char billing code,ICD10CM
40618387,Chronic osteomyelitis of shoulder region,Disorder,SNOMED
45571554,Diffuse large B-cell lymphoma, lymph nodes of multiple sites,5-char billing code,ICD10CM
45566636,Other non-follicular lymphoma, lymph nodes of multiple sites,5-char billing code,ICD10CM
45576364,Other specified types of non-Hodgkin lymphoma, lymph nodes of multiple sites,5-char billing code,ICD10CM
35206424,Other specified types of non-Hodgkin's lymphoma, extranodal and solid organ sites,5-char billing code,ICD10CM
44836861,Anaplastic large cell lymphoma, lymph nodes of multiple sites,5-dig billing code,ICD9CM
45537865,Anaplastic large cell lymphoma, ALK-positive, lymph nodes of multiple sites,5-char billing code,ICD10CM
45537856,Diffuse follicle center lymphoma, lymph nodes of multiple sites,5-char billing code,ICD10CM
45586033,Follicular lymphoma grade III, unspecified, lymph nodes of multiple sites,5-char billing code,ICD10CM
44829828,Primary central nervous system lymphoma, lymph nodes of multiple sites,5-dig billing code,ICD9CM
44831011,Other malignant lymphomas, lymph nodes of multiple sites,5-dig billing code,ICD9CM
45595707,Lymphoblastic (diffuse) lymphoma, lymph nodes of multiple sites,5-char billing code,ICD10CM
132841,Malignant lymphoma of lymph nodes of multiple sites,Disorder,SNOMED
36684814,Non-Hodgkin's lymphoma of lymph nodes of multiple sites,Disorder,SNOMED
45595710,Anaplastic large cell lymphoma, ALK-negative, lymph nodes of multiple sites,5-char billing code,ICD10CM
44822895,Large cell lymphoma, lymph nodes of multiple sites,5-dig billing code,ICD9CM
45552308,Mediastinal (thymic) large B-cell lymphoma, lymph nodes of multiple sites,5-char billing code,ICD10CM
45605317,Peripheral T-cell lymphoma, not elsewhere classified, lymph nodes of multiple sites,5-char billing code,ICD10CM
44836857,Marginal zone lymphoma, lymph nodes of multiple sites,5-dig billing code,ICD9CM
45547548,Unspecified B-cell lymphoma, lymph nodes of multiple sites,5-char billing code,ICD10CM
45552307,Other mature T/NK-cell lymphomas, lymph nodes of multiple sites,5-char billing code,ICD10CM
45581246,Cutaneous T-cell lymphoma, unspecified, lymph nodes of multiple sites,5-char billing code,ICD10CM
45561856,Non-follicular (diffuse) lymphoma, unspecified, lymph nodes of multiple sites,5-char billing code,ICD10CM
44826429,Peripheral T cell lymphoma, lymph nodes of multiple sites,5-dig billing code,ICD9CM
45571564,Mature T/NK-cell lymphomas, unspecified, lymph nodes of multiple sites,5-char billing code,ICD10CM
45576352,Follicular lymphoma grade IIIb, lymph nodes of multiple sites,5-char billing code,ICD10CM
45537852,Follicular lymphoma grade II, lymph nodes of multiple sites,5-char billing code,ICD10CM
316356,Hodgkin's disease of lymph nodes of multiple sites,Disorder,SNOMED
45576351,Follicular lymphoma grade IIIa, lymph nodes of multiple sites,5-char billing code,ICD10CM
45542665,Other myeloid leukemia, in remission,5-char billing code,ICD10CM
44821762,Other myeloid leukemia, in remission,5-dig billing code,ICD9CM
44829847,Unspecified myeloid leukemia, in remission,5-dig billing code,ICD9CM
40649780,Subacute myeloid leukemia in remission,Disorder,SNOMED
135762,Acute myeloid leukemia in remission,Disorder,SNOMED
136367,Erythroleukemia in remission,Disorder,SNOMED
40649778,Subacute monocytic leukemia in remission,Disorder,SNOMED
45576369,Myeloid leukemia, unspecified in remission,5-char billing code,ICD10CM
40645853,Chronic monocytic leukemia in remission,Disorder,SNOMED
37311926,Juvenile myelomonocytic leukemia in remission,Disorder,SNOMED
4143382,Subacute myeloid leukemia in remission,Disorder,SNOMED
40647633,Monocytic leukemia in remission,Disorder,SNOMED
760934,Lymphoid leukemia in relapse,Disorder,SNOMED
45595720,Other lymphoid leukemia not having achieved remission,5-char billing code,ICD10CM
4097580,Other lymphoid leukemia NOS,Disorder,SNOMED
44821758,Lymphoid leukemia,3-dig nonbill code,ICD9CM
1567680,Lymphoid leukemia,3-char nonbill code,ICD10CM
40647531,Lymphoid leukemia,Disorder,SNOMED
44831015,Other lymphoid leukemia, without mention of having achieved remission,5-dig billing code,ICD9CM
40387126,Lymphosarcoma cell leukemia,Disorder,SNOMED
1567688,Lymphoid leukemia, unspecified,4-char nonbill code,ICD10CM
44824053,Other lymphoid leukemia,4-dig nonbill code,ICD9CM
132853,Lymphoid leukemia,Disorder,SNOMED
45576366,Other lymphoid leukemia, in relapse,5-char billing code,ICD10CM
44820643,Unspecified lymphoid leukemia, without mention of having achieved remission,5-dig billing code,ICD9CM
4097100,Other lymphoid leukemia,Disorder,SNOMED
4094549,Aleukemic lymphoid leukemia,Disorder,SNOMED
44797629,[X]Other lymphoid leukaemia,Disorder,SNOMED
136656,Subacute lymphoid leukemia,Disorder,SNOMED
134305,Acute lymphoid leukemia,Disorder,SNOMED
44820642,Unspecified lymphoid leukemia,4-dig nonbill code,ICD9CM
4082460,Large granular lymphocytic leukemia,Disorder,SNOMED
4094550,Adult T-cell leukemia,Disorder,SNOMED
40352621,Leukemia: [lymphoid] or [monocytic] or [myeloid] or [specific cell type],Disorder,SNOMED
4091924,Lymphoid leukemia NOS,Disorder,SNOMED
40385843,[X]Other lymphoid leukemia,Disorder,SNOMED
1567687,Other lymphoid leukemia,4-char nonbill code,ICD10CM
138379,Chronic lymphoid leukemia, disease,Disorder,SNOMED
43021265,History of lymphoid leukemia,Context-dependent,SNOMED
45586065,Lymphoid leukemia, unspecified, in relapse,5-char billing code,ICD10CM
134596,Lymphoid leukemia in remission,Disorder,SNOMED
4001331,Prolymphocytic leukemia (clinical),Disorder,SNOMED
3531793,Lymphoid leukaemia NOS,Disorder,SNOMED
40276290,Other type of lymphoid leukemia (clinical),Disorder,SNOMED
45595719,Lymphoid leukemia, unspecified not having achieved remission,5-char billing code,ICD10CM
44835414,Personal history of lymphoid leukemia,5-dig billing V code,ICD9CM
3531792,Other lymphoid leukaemia NOS,Disorder,SNOMED
40320654,Leukemia: [lymphoid] or [monocytic] or [myeloid] or [specific cell type],Disorder,SNOMED
3540749,Acute osteomyelitis NOS,Disorder,SNOMED
134738,Acute osteomyelitis of multiple sites,Disorder,SNOMED
3539617,Acute osteomyelitis of other specified site,Disorder,SNOMED
3540745,Acute osteomyelitis of unspecified site,Disorder,SNOMED
4215452,Acute osteomyelitis of pelvic region,Disorder,SNOMED
44833856,Acute osteomyelitis, site unspecified,5-dig billing code,ICD9CM
40321396,Acute osteomyelitis NOS,Disorder,SNOMED
133570,Acute osteomyelitis of pelvic region and/or thigh,Disorder,SNOMED
40480703,Acute osteomyelitis of vertebra,Disorder,SNOMED
1571194,Other acute osteomyelitis,4-char nonbill code,ICD10CM
4003293,Acute osteomyelitis of carpal bone,Disorder,SNOMED
133002,Acute osteomyelitis,Disorder,SNOMED
4121601,Acute osteomyelitis of knee,Disorder,SNOMED
44836218,Acute osteomyelitis, other specified sites,5-dig billing code,ICD9CM
45587166,Other acute osteomyelitis, unspecified site,5-char billing code,ICD10CM
136511,Acute osteomyelitis of forearm,Disorder,SNOMED
40321387,Acute osteomyelitis,Disorder,SNOMED
4032851,Acute osteomyelitis of facial bone,Disorder,SNOMED
45567757,Other acute osteomyelitis, other site,5-char billing code,ICD10CM
133573,Acute osteomyelitis of shoulder region,Disorder,SNOMED
141944,Acute osteomyelitis of humerus,Disorder,SNOMED
4001819,Acute hematogenous osteomyelitis,Disorder,SNOMED
44832664,Acute osteomyelitis,4-dig nonbill code,ICD9CM
40622329,Acute osteomyelitis,Disorder,SNOMED
4003167,Acute osteomyelitis of other specified site,Disorder,SNOMED
40405987,(Bone: [abscess] or [acute infection]) or (acute osteomyelitis),Disorder,SNOMED
4317283,Acute osteomyelitis of cranium,Disorder,SNOMED
4001143,Acute osteomyelitis of unspecified site,Disorder,SNOMED
141662,Acute osteomyelitis of hand,Disorder,SNOMED
4002828,Acute osteomyelitis NOS,Disorder,SNOMED
141666,Acute osteomyelitis of lower leg,Disorder,SNOMED
4001282,Acute osteomyelitis of femur,Disorder,SNOMED
4118015,Acute osteomyelitis of elbow,Disorder,SNOMED
40491168,Acute osteomyelitis of other specific site, NEC,Disorder,SNOMED
4115172,Acute osteomyelitis of hip,Disorder,SNOMED
135350,Acute osteomyelitis of ankle and/or foot,Disorder,SNOMED
1571203,Subacute osteomyelitis, shoulder,5-char nonbill code,ICD10CM
45582322,Subacute osteomyelitis, left shoulder,6-char billing code,ICD10CM
45572642,Subacute osteomyelitis, unspecified shoulder,6-char billing code,ICD10CM
44824530,Unspecified osteomyelitis, shoulder region,5-dig billing code,ICD9CM
42534902,Osteomyelitis of left shoulder,Disorder,SNOMED
45577455,Other osteomyelitis, shoulder,6-char billing code,ICD10CM
4001964,Osteomyelitis of clavicle,Disorder,SNOMED
45534030,Subacute osteomyelitis, right shoulder,6-char billing code,ICD10CM
42534901,Osteomyelitis of right shoulder,Disorder,SNOMED
40320653,(Plasma cell leukemia) or (immunoproliferative neoplasm NOS),Disorder,SNOMED
760936,Plasma cell leukemia in relapse,Disorder,SNOMED
44821756,Plasma cell leukemia,4-dig nonbill code,ICD9CM
133154,Plasma cell leukemia,Disorder,SNOMED
44821757,Plasma cell leukemia, without mention of having achieved remission,5-dig billing code,ICD9CM
40387086,Plasma cell leukemia,Disorder,SNOMED
45557038,Plasma cell leukemia not having achieved remission,5-char billing code,ICD10CM
40352619,(Plasma cell leukemia) or (immunoproliferative neoplasm NOS),Disorder,SNOMED
1567677,Plasma cell leukemia,4-char nonbill code,ICD10CM
133158,Plasma cell leukemia in remission,Disorder,SNOMED
45595716,Plasma cell leukemia in remission,5-char billing code,ICD10CM
44825230,Plasma cell leukemia, in remission,5-dig billing code,ICD9CM
40632120,Myelosclerosis,Disorder,SNOMED
133169,Myelofibrosis,Disorder,SNOMED
36678497,Congenital neutropenia, myelofibrosis, nephromegaly syndrome,Disorder,SNOMED
44782465,Ischemic myelofibrosis,Disorder,SNOMED
760840,Myelofibrosis due to another disorder,Disorder,SNOMED
140064,Primary myelofibrosis,Disorder,SNOMED
44834579,Myelofibrosis,5-dig billing code,ICD9CM
45605385,Myelofibrosis,5-char billing code,ICD10CM
40321733,(Other blood diseases NOS) or (myelofibrosis),Disorder,SNOMED
40351360,(Other blood diseases NOS) or (myelofibrosis),Disorder,SNOMED
4003184,Acute panmyelosis with myelofibrosis,Disorder,SNOMED
607402,Myelofibrosis caused by drug,Disorder,SNOMED
45558072,Subacute osteomyelitis, unspecified humerus,6-char billing code,ICD10CM
45606417,Subacute osteomyelitis, left humerus,6-char billing code,ICD10CM
45538961,Subacute osteomyelitis, right humerus,6-char billing code,ICD10CM
133296,Osteomyelitis of upper arm,Disorder,SNOMED
44832667,Unspecified osteomyelitis, upper arm,5-dig billing code,ICD9CM
136205,Chronic osteomyelitis of upper arm,Disorder,SNOMED
1571204,Subacute osteomyelitis, humerus,5-char nonbill code,ICD10CM
46273644,Chronic osteomyelitis of humerus with draining sinus,Disorder,SNOMED
45558075,Other osteomyelitis, upper arm,6-char billing code,ICD10CM
133438,Chronic lymphoid leukemia in remission,Disorder,SNOMED
45561871,Chronic lymphocytic leukemia of B-cell type in remission,5-char billing code,ICD10CM
37312023,B-cell prolymphocytic leukemia in remission,Disorder,SNOMED
44825231,Chronic lymphoid leukemia, in remission,5-dig billing code,ICD9CM
45582320,Other acute osteomyelitis, unspecified shoulder,6-char billing code,ICD10CM
40321389,Acute osteomyelitis of the shoulder region,Disorder,SNOMED
4003168,Acute osteomyelitis of clavicle,Disorder,SNOMED
44833857,Acute osteomyelitis, shoulder region,5-dig billing code,ICD9CM
45562939,Other acute osteomyelitis, left shoulder,6-char billing code,ICD10CM
4001815,Acute osteomyelitis of scapula,Disorder,SNOMED
40405989,Acute osteomyelitis of the shoulder region,Disorder,SNOMED
45538959,Other acute osteomyelitis, right shoulder,6-char billing code,ICD10CM
1571195,Other acute osteomyelitis, shoulder,5-char nonbill code,ICD10CM
45553374,Other osteomyelitis, ankle and foot,6-char billing code,ICD10CM
45771079,Osteomyelitis of ankle,Disorder,SNOMED
45582323,Subacute osteomyelitis, right ankle and foot,6-char billing code,ICD10CM
45763907,Osteomyelitis of hindfoot,Disorder,SNOMED
44825724,Unspecified osteomyelitis, ankle and foot,5-dig billing code,ICD9CM
1246044,Osteomyelitis of foot,Disorder,SNOMED
133853,Osteomyelitis of ankle AND/OR foot,Disorder,SNOMED
45763906,Osteomyelitis of midfoot,Disorder,SNOMED
44810675,Osteomyelitis of forefoot,Disorder,SNOMED
1571209,Subacute osteomyelitis, ankle and foot,5-char nonbill code,ICD10CM
46271951,Chronic osteomyelitis of ankle and/or foot with draining sinus,Disorder,SNOMED
137077,Chronic osteomyelitis of ankle and/or foot,Disorder,SNOMED
45577444,Subacute osteomyelitis, left ankle and foot,6-char billing code,ICD10CM
45601641,Subacute osteomyelitis, unspecified ankle and foot,6-char billing code,ICD10CM
134137,Osteomyelitis of multiple sites,Disorder,SNOMED
45601646,Other osteomyelitis, multiple sites,6-char billing code,ICD10CM
137964,Chronic osteomyelitis of multiple sites,Disorder,SNOMED
44836220,Unspecified osteomyelitis, multiple sites,5-dig billing code,ICD9CM
40635450,Chronic osteomyelitis of lower leg,Disorder,SNOMED
45572645,Chronic multifocal osteomyelitis, left tibia and fibula,6-char billing code,ICD10CM
45553370,Other chronic hematogenous osteomyelitis, left tibia and fibula,6-char billing code,ICD10CM
45582328,Other chronic osteomyelitis, unspecified tibia and fibula,6-char billing code,ICD10CM
45538970,Other chronic hematogenous osteomyelitis, unspecified tibia and fibula,6-char billing code,ICD10CM
45606419,Chronic multifocal osteomyelitis, unspecified tibia and fibula,6-char billing code,ICD10CM
37173697,Chronic osteomyelitis of left lower leg,Disorder,SNOMED
46270395,Chronic osteomyelitis of lower leg with draining sinus,Disorder,SNOMED
1571240,Other chronic osteomyelitis, tibia and fibula,5-char nonbill code,ICD10CM
134141,Chronic osteomyelitis of lower leg,Disorder,SNOMED
37173698,Chronic osteomyelitis of right lower leg,Disorder,SNOMED
45606423,Other chronic osteomyelitis, right tibia and fibula,6-char billing code,ICD10CM
4196998,Chronic osteomyelitis of tibia,Disorder,SNOMED
45534040,Other chronic osteomyelitis, left tibia and fibula,6-char billing code,ICD10CM
1571232,Other chronic hematogenous osteomyelitis, tibia and fibula,5-char nonbill code,ICD10CM
44837371,Chronic osteomyelitis, lower leg,5-dig billing code,ICD9CM
45543785,Other chronic hematogenous osteomyelitis, right tibia and fibula,6-char billing code,ICD10CM
1571216,Chronic multifocal osteomyelitis, tibia and fibula,5-char nonbill code,ICD10CM
45534033,Chronic multifocal osteomyelitis, right tibia and fibula,6-char billing code,ICD10CM
44827443,Salmonella osteomyelitis,5-dig billing code,ICD9CM
134264,Salmonella osteomyelitis,Disorder,SNOMED
40381821,Salmonella osteomyelitis,Disorder,SNOMED
45590790,Salmonella osteomyelitis,5-char billing code,ICD10CM
4079281,Null cell acute lymphoblastic leukemia,Disorder,SNOMED
37018869,Disorder of central nervous system co-occurrent and due to acute lymphoid leukemia,Disorder,SNOMED
44821759,Lymphoid leukemia, acute,4-dig nonbill code,ICD9CM
4081867,Acute biphenotypic leukemia,Disorder,SNOMED
44829844,Acute lymphoid leukemia, without mention of having achieved remission,5-dig billing code,ICD9CM
45566647,Acute lymphoblastic leukemia, in relapse,5-char billing code,ICD10CM
4082461,Precursor B-cell acute lymphoblastic leukemia,Disorder,SNOMED
4173963,B-cell acute lymphoblastic leukemia,Disorder,SNOMED
4082462,T-lymphoblastic leukemia,Disorder,SNOMED
3654650,B lymphoblastic leukemia lymphoma with t(1;19)(Q23;P13.3); E2A-PBX1 (TCF3/PBX1),Disorder,SNOMED
3654648,B lymphoblastic leukemia lymphoma with t(v;11q23); MLL rearranged,Disorder,SNOMED
141816,Acute lymphoid leukemia in remission,Disorder,SNOMED
1567681,Acute lymphoblastic leukemia [ALL],4-char nonbill code,ICD10CM
3654653,B lymphoblastic leukemia lymphoma with hyperdiploidy,Disorder,SNOMED
602616,History of acute lymphoid leukemia,Context-dependent,SNOMED
3654651,B lymphoblastic leukemia lymphoma with hypodiploidy,Disorder,SNOMED
4138008,Philadelphia chromosome-positive acute lymphoblastic leukemia,Disorder,SNOMED
3654647,B lymphoblastic leukemia lymphoma with t(5;14)(q31;q32); IL3-IGH,Disorder,SNOMED
3654649,B lymphoblastic leukemia lymphoma with t(12;21) (p13;q22); TEL/AML1 (ETV6-RUNX1),Disorder,SNOMED
4153344,Acute lymphoblastic leukemia, transitional pre-B-cell,Disorder,SNOMED
