CONCEPT_ID,CONCEPT_NAME,CONCEPT_CLASS_ID,CONCEPT_VOCAB_ID
313980,Hodgkin's disease, lymphocytic depletion of lymph nodes of multiple sites,Disorder,SNOMED
40648858,Hodgkin's disease, lymphocytic depletion of lymph nodes of multiple sites,Disorder,SNOMED
45581231,Lymphocyte depleted Hodgkin lymphoma, lymph nodes of multiple sites,5-char billing code,ICD10CM
44836865,Hodgkin's disease, lymphocytic depletion, lymph nodes of multiple sites,5-dig billing code,ICD9CM
4130834,Histiocytic necrotizing lymphadenitis,Disorder,SNOMED
313989,Chronic lymphadenitis,Disorder,SNOMED
40321727,Chronic lymphadenitis,Disorder,SNOMED
3520023,Unspecified lymphadenitis, excluding mesenteric lymphadenitis,Disorder,SNOMED
4120259,Chronic Malayan filarial lymphadenitis,Disorder,SNOMED
35207908,Chronic lymphadenitis, except mesenteric,4-char billing code,ICD10CM
37312009,Chronic axillary lymphadenitis,Disorder,SNOMED
37312008,Chronic cervical lymphadenitis,Disorder,SNOMED
4098153,Chronic mesenteric lymphadenitis,Disorder,SNOMED
37312007,Chronic inguinal lymphadenitis,Disorder,SNOMED
4119770,Chronic bancroftian lymphadenitis,Disorder,SNOMED
4124985,Chronic Timorian filarial lymphadenitis,Disorder,SNOMED
4100244,Unspecified lymphadenitis, excluding mesenteric lymphadenits,Disorder,SNOMED
44831074,Chronic lymphadenitis,4-dig billing code,ICD9CM
3534086,Acute febrile mucocutaneous lymph node syndrome NOS,Disorder,SNOMED
40315983,Kawasaki's disease,Disorder,SNOMED
44832395,Acute febrile mucocutaneous lymph node syndrome [MCLS],4-dig billing code,ICD9CM
40393237,Kawasaki's disease,Disorder,SNOMED
35615119,Aneurysm of coronary artery due to and following acute febrile mucocutaneous lymph node syndrome,Disorder,SNOMED
314381,Acute febrile mucocutaneous lymph node syndrome,Disorder,SNOMED
35208814,Mucocutaneous lymph node syndrome [Kawasaki],4-char billing code,ICD10CM
37209520,History of acute febrile mucocutaneous lymph node syndrome,Context-dependent,SNOMED
618979,Myocarditis due to Kawasaki disease,Disorder,SNOMED
4108506,Acute febrile mucocutaneous lymph node syndrome NOS,Disorder,SNOMED
4302666,Body temperature,Observable Entity,SNOMED
40648879,Hodgkin's disease, mixed cellularity of lymph nodes of multiple sites,Disorder,SNOMED
315202,Hodgkin's disease, mixed cellularity of lymph nodes of multiple sites,Disorder,SNOMED
44834510,Hodgkin's disease, mixed cellularity, lymph nodes of multiple sites,5-dig billing code,ICD9CM
45566623,Mixed cellularity Hodgkin lymphoma, lymph nodes of multiple sites,5-char billing code,ICD10CM
444441,Burkitt's tumor of lymph nodes of multiple sites,Disorder,SNOMED
45561854,Burkitt lymphoma, lymph nodes of multiple sites,5-char billing code,ICD10CM
44832138,Burkitt's tumor or lymphoma, lymph nodes of multiple sites,5-dig billing code,ICD9CM
315481,Burkitt's lymphoma of lymph nodes of multiple sites,Disorder,SNOMED
40320664,[M]Subacute monocytic leukemia,Disorder,SNOMED
40649779,Subacute monocytic leukemia,Disorder,SNOMED
4091929,Subacute leukemia NOS,Disorder,SNOMED
44820647,Monocytic leukemia, subacute,4-dig nonbill code,ICD9CM
44826434,Subacute monocytic leukemia, in relapse,5-dig billing code,ICD9CM
44829850,Subacute leukemia of unspecified cell type, without mention of having achieved remission,5-dig billing code,ICD9CM
40649781,Subacute myeloid leukemia,Disorder,SNOMED
44820646,Subacute myeloid leukemia, without mention of having achieved remission,5-dig billing code,ICD9CM
313430,Subacute monocytic leukemia,Disorder,SNOMED
40385026,[M]Subacute monocytic leukemia,Disorder,SNOMED
44835717,Subacute leukemia of unspecified cell type, in relapse,5-dig billing code,ICD9CM
3520956,Subacute leukaemia NOS,Disorder,SNOMED
40320671,Subacute leukemia NOS,Disorder,SNOMED
44834520,Myeloid leukemia, subacute,4-dig nonbill code,ICD9CM
44824055,Leukemia of unspecified cell type, subacute,4-dig nonbill code,ICD9CM
44825233,Subacute monocytic leukemia, without mention of having achieved remission,5-dig billing code,ICD9CM
44827585,Subacute myeloid leukemia, in relapse,5-dig billing code,ICD9CM
4097707,Subacute myelomonocytic leukemia,Disorder,SNOMED
44824067,Benign neoplasm of lymph nodes,4-dig billing code,ICD9CM
315505,Benign neoplasm of lymph node,Disorder,SNOMED
37311851,Melanocytic nevus of lymph node,Disorder,SNOMED
4239896,Benign neoplasm of intra-abdominal lymph nodes,Disorder,SNOMED
4240020,Benign neoplasm of lymph nodes of lower limb,Disorder,SNOMED
4243433,Benign neoplasm of lymph nodes of upper limb,Disorder,SNOMED
4240011,Benign neoplasm of intrapelvic lymph nodes,Disorder,SNOMED
40389011,Benign neoplasm of lymph nodes,Disorder,SNOMED
4239895,Benign neoplasm of intestinal lymph nodes,Disorder,SNOMED
4242356,Benign neoplasm of lymph nodes of multiple sites,Disorder,SNOMED
4243428,Benign neoplasm of lymph nodes of head,Disorder,SNOMED
4243432,Benign neoplasm of lymph nodes of neck,Disorder,SNOMED
35206618,Benign neoplasm of lymph nodes,4-char billing code,ICD10CM
4240012,Benign neoplasm of intrathoracic lymph nodes,Disorder,SNOMED
4130067,Sickle cell-beta-thalassemia,Disorder,SNOMED
315523,Sickle cell-thalassemia disease,Disorder,SNOMED
443738,Sickle cell-thalassemia disease with crisis,Disorder,SNOMED
1567847,Sickle-cell thalassemia,4-char nonbill code,ICD10CM
321263,Sickle cell-thalassemia disease without crisis,Disorder,SNOMED
785898,Sickle-cell thalassemia, unspecified, with dactylitis,6-char billing code,ICD10CM
4131914,Sickle cell anemia with coexistent alpha-thalassemia,Disorder,SNOMED
315763,Hodgkin's disease, nodular sclerosis of lymph nodes of multiple sites,Disorder,SNOMED
40648889,Hodgkin's disease, nodular sclerosis of lymph nodes of multiple sites,Disorder,SNOMED
45537847,Nodular sclerosis Hodgkin lymphoma, lymph nodes of multiple sites,5-char billing code,ICD10CM
44821747,Hodgkin's disease, nodular sclerosis, lymph nodes of multiple sites,5-dig billing code,ICD9CM
35207910,Nonspecific lymphadenitis, unspecified,4-char billing code,ICD10CM
40321729,Lymphadenitis NOS,Disorder,SNOMED
4119915,Lymphadenitis NOS,Disorder,SNOMED
435234,Mesenteric lymphadenitis,Disorder,SNOMED
4212138,Piringer's lymphadenitis,Disorder,SNOMED
40354874,Inflammation of lymph node,Clinical Finding,SNOMED
4081069,Lofgrens syndrome,Disorder,SNOMED
4265482,Epizootic lymphadenitis,Disorder,SNOMED
3542228,Lymphadenitis NOS,Disorder,SNOMED
35207909,Other nonspecific lymphadenitis,4-char billing code,ICD10CM
1569417,Nonspecific lymphadenitis,3-char nonbill code,ICD10CM
44812759,[X]Other nonspecific lymphadenitis,Disorder,SNOMED
37164853,Lymphadenitis caused by Toxoplasma gondii,Disorder,SNOMED
4141212,Granulomatous lymphadenitis,Disorder,SNOMED
4168285,Suppurative lymphadenopathy,Disorder,SNOMED
4148052,Cervical lymphadenitis,Disorder,SNOMED
40487345,Necrotizing lymphadenitis,Disorder,SNOMED
44820705,Lymphadenitis, unspecified, except mesenteric,4-dig billing code,ICD9CM
4141525,Adenolymphangitis,Disorder,SNOMED
4256233,Hemorrhagic thoracic lymphadenitis,Disorder,SNOMED
40394554,[X]Other nonspecific lymphadenitis,Disorder,SNOMED
318222,Acute lymphadenitis,Disorder,SNOMED
45772905,Mycobacterial lymphadenitis,Disorder,SNOMED
4210780,Piringer-Kuchinka's syndrome,Disorder,SNOMED
45605298,Other Hodgkin lymphoma, lymph nodes of multiple sites,5-char billing code,ICD10CM
45581233,Hodgkin lymphoma, unspecified, lymph nodes of multiple sites,5-char billing code,ICD10CM
44829837,Hodgkin's disease, unspecified type, lymph nodes of multiple sites,5-dig billing code,ICD9CM
316649,Hodgkin's sarcoma of lymph nodes of multiple sites,Disorder,SNOMED
40648929,Hodgkin's sarcoma of lymph nodes of multiple sites,Disorder,SNOMED
44826422,Hodgkin's sarcoma, lymph nodes of multiple sites,5-dig billing code,ICD9CM
44831077,Unspecified diseases of blood and blood-forming organs,4-dig billing code,ICD9CM
4030445,Acquired PF-3 disease,Disorder,SNOMED
46271435,Periodontitis co-occurrent with hematologic disorder,Disorder,SNOMED
40391373,[X]Other specified diseases of blood and blood-forming organs,Disorder,SNOMED
4121123,Hemophagocytic lymphohistiocytosis,Disorder,SNOMED
4098160,Other specified other disease of blood or blood-forming organ,Disorder,SNOMED
4159967,Diarrhea-negative hemolytic uremic syndrome,Disorder,SNOMED
4101134,Blood dyscrasia NOS,Disorder,SNOMED
4032352,Hemolytic anemia caused by hyperbaric oxygen,Disorder,SNOMED
4144956,Hereditary spherocytosis due to deficiency of protein 4.2,Disorder,SNOMED
4121264,Epstein syndrome,Disorder,SNOMED
4098161,Other specified disorders of blood or blood-forming organ,Disorder,SNOMED
4301874,Erythrocytosis due to pulmonary disease,Disorder,SNOMED
4099224,Hereditary spherocytosis due to spectrin deficiency,Disorder,SNOMED
44800621,[X]Other disorders of the blood and blood-forming organs in diseases classified elsewhere,Disorder,SNOMED
44836953,Other specified diseases of blood and blood-forming organs,4-dig nonbill code,ICD9CM
4222402,Hematopoietic system disease with AIDS (acquired immunodeficiency syndrome),Disorder,SNOMED
45557088,Other specified aplastic anemias and other bone marrow failure syndromes,5-char billing code,ICD10CM
45765493,Autoimmune lymphoproliferative syndrome,Disorder,SNOMED
4320651,Hereditary spherocytosis due to beta spectrin defect,Disorder,SNOMED
44797728,[X]Other diseases of blood and blood-forming organs,Disorder,SNOMED
40391375,[X]Other disorders of the blood and blood-forming organs in diseases classified elsewhere,Disorder,SNOMED
4030593,Benign granulocytopenia in childhood,Disorder,SNOMED
1567873,Other and unspecified diseases of blood and blood-forming organs,3-char nonbill code,ICD10CM
439412,Mast cell disorder,Disorder,SNOMED
3542007,Other blood diseases NOS,Disorder,SNOMED
4286058,Lymphocytic hypoplasia,Disorder,SNOMED
35206797,Other disorders of blood and blood-forming organs in diseases classified elsewhere,3-char billing code,ICD10CM
44822965,Other diseases of blood and blood-forming organs,3-dig nonbill code,ICD9CM
37162245,Mucopolysaccharidosis-like plus disease,Disorder,SNOMED
40480576,Myeloid metaplasia,Disorder,SNOMED
4302298,Hemolytic uremic syndrome, adult type,Disorder,SNOMED
4137430,Idiopathic thrombocytopenic purpura,Disorder,SNOMED
4101130,Other diseases of blood or blood-forming organs,Disorder,SNOMED
37016333,Albinism co-occurrent with hematologic disorder,Disorder,SNOMED
4113649,Other blood diseases NOS,Disorder,SNOMED
4030442,Chronic benign neutropenia of childhood,Disorder,SNOMED
4143357,Other specified disease of blood or blood-forming organ NOS,Disorder,SNOMED
44801220,[X]Other specified diseases of blood and blood-forming organs,Disorder,SNOMED
4032353,Chronic idiopathic immunoneutropenia in adult,Disorder,SNOMED
45542717,Other specified diseases of blood and blood-forming organs,5-char billing code,ICD10CM
35206792,Disease of blood and blood-forming organs, unspecified,4-char billing code,ICD10CM
4098159,Other specified diseases of blood and blood-forming organs,Disorder,SNOMED
4121115,Sickle cell anemia with high hemoglobin F,Disorder,SNOMED
604666,B cell lymphocyte aplasia caused by drug,Disorder,SNOMED
44835740,Other lymphatic and hematopoietic tissues,5-dig billing code,ICD9CM
4267646,Hemolytic uremic syndrome of childhood,Disorder,SNOMED
44834580,Other specified diseases of blood and blood-forming organs,5-dig billing code,ICD9CM
4030443,Chronic hypoplastic neutropenia,Disorder,SNOMED
44796372,[X]Additional blood and blood-forming organ disease classification terms,Disorder,SNOMED
1567874,Other specified diseases of blood and blood-forming organs,4-char nonbill code,ICD10CM
37402357,Other platelet-activating anti-PF4 disorders,5-char billing code,ICD10CM
4212885,Disorder of hematopoietic system in newborn,Disorder,SNOMED
44794008,[X]Other specified leukaemias,Disorder,SNOMED
3531065,Other leukaemia of unspecified cell type,Disorder,SNOMED
3539284,Leukaemia of unspecified cell type,Disorder,SNOMED
1567710,Other specified leukemias,4-char nonbill code,ICD10CM
4002496,Mast cell leukemia (clinical),Disorder,SNOMED
3519452,Leukaemia NOS,Disorder,SNOMED
44794578,[X]Other leukaemia of unspecified cell type,Disorder,SNOMED
44822655,Personal history of leukemia,4-dig nonbill V code,ICD9CM
40385847,[X]Other specified leukemias,Disorder,SNOMED
44819469,Other specified leukemia,4-dig nonbill code,ICD9CM
44827586,Other specified leukemia,3-dig nonbill code,ICD9CM
4091930,Other leukemia of unspecified cell type,Disorder,SNOMED
36717231,Meningeal leukemia,Disorder,SNOMED
44831019,Other specified leukemia, without mention of having achieved remission,5-dig billing code,ICD9CM
1567705,Other leukemias of specified cell type,3-char nonbill code,ICD10CM
44813018,[V]Personal history of leukaemia,Context-dependent,SNOMED
40352623,(Aleukemic leukemia) or (leukemia - unspec cell NOS),Disorder,SNOMED
3539282,Other and unspecified leukaemia,Disorder,SNOMED
36684812,Small lymphocytic B-cell lymphoma of lymph nodes of multiple sites,Disorder,SNOMED
44829585,Personal history of other leukemia,5-dig billing V code,ICD9CM
40302015,H/O: * leukemia,Context-dependent,SNOMED
4121332,Aleukemic leukemia,Disorder,SNOMED
45767656,Gingivitis due to leukemia,Disorder,SNOMED
44826436,Other leukemia of unspecified cell type, without mention of having achieved remission,5-dig billing code,ICD9CM
44829849,Leukemia of unspecified cell type,3-dig nonbill code,ICD9CM
1567711,Leukemia of unspecified cell type,3-char nonbill code,ICD10CM
44833343,Other specified leukemia, in relapse,5-dig billing code,ICD9CM
4097103,Other and unspecified leukemia NOS,Disorder,SNOMED
40385848,[X]Other leukemia of unspecified cell type,Disorder,SNOMED
44829851,Other leukemia of unspecified cell type,4-dig nonbill code,ICD9CM
3537379,Other specified leukaemia,Disorder,SNOMED
36684813,Small lymphocytic B-cell lymphoma of intra-abdominal lymph nodes,Disorder,SNOMED
35225341,Personal history of leukemia,4-char billing code,ICD10CM
44828761,Other leukemia of unspecified cell type, in relapse,5-dig billing code,ICD9CM
3539283,Other specified leukaemia NOS,Disorder,SNOMED
40649775,Subacute leukemia,Disorder,SNOMED
45586072,Other specified leukemias, in relapse,5-char billing code,ICD10CM
44821501,Personal history of leukemia, unspecified,5-dig billing V code,ICD9CM
40320666,Leukemia of unspecified cell type,Disorder,SNOMED
4058706,History of leukemia,Context-dependent,SNOMED
40320672,(Aleukemic leukemia) or (leukemia - unspec cell NOS),Disorder,SNOMED
45590968,Leukemia, unspecified not having achieved remission,5-char billing code,ICD10CM
40320665,Leukemia - specif. cell NOS,Disorder,SNOMED
4051110,Family history of leukemia,Context-dependent,SNOMED
40523863,[V]Personal history of leukemia,Context-dependent,SNOMED
4097704,Other specified leukemia,Disorder,SNOMED
45542668,Other specified leukemias not having achieved remission,5-char billing code,ICD10CM
44827588,Unspecified leukemia,4-dig nonbill code,ICD9CM
4097105,Leukemia NOS,Disorder,SNOMED
46271363,Periodontitis co-occurrent with leukemia,Disorder,SNOMED
4202548,Suspected leukemia,Context-dependent,SNOMED
3536935,Leukaemia - specific cell NOS,Disorder,SNOMED
36683266,Classic mast cell leukemia,Disorder,SNOMED
4097104,Other specified leukemia NOS,Disorder,SNOMED
1567714,Leukemia, unspecified,4-char nonbill code,ICD10CM
40456313,Leukemia,Disorder,SNOMED
44829852,Unspecified leukemia, without mention of having achieved remission,5-dig billing code,ICD9CM
4152528,Leukemia - specif. cell NOS,Disorder,SNOMED
4097102,Other and unspecified leukemia,Disorder,SNOMED
4091927,Leukemia of unspecified cell type,Disorder,SNOMED
4095897,Compound leukemias,Disorder,SNOMED
44835718,Unspecified leukemia, in relapse,5-dig billing code,ICD9CM
45576371,Leukemia, unspecified, in relapse,5-char billing code,ICD10CM
40319715,Acute lymphadenitis,Disorder,SNOMED
4061728,Acute lymphadenitis of upper limb,Disorder,SNOMED
44828002,Acute lymphadenitis,3-dig billing code,ICD9CM
40397902,[X]Acute lymphadenitis of other sites,Disorder,SNOMED
35208424,Acute lymphadenitis, unspecified,4-char billing code,ICD10CM
44797005,[X]Acute lymphadenitis of other sites,Disorder,SNOMED
1569753,Acute lymphadenitis,3-char nonbill code,ICD10CM
4066373,Acute lymphadenitis of trunk,Disorder,SNOMED
4063918,Acute lymphadenitis of lower limb,Disorder,SNOMED
40395365,Acute: [lymphadenitis] or [abscess lymph node] or [cervical adenitis],Disorder,SNOMED
4063919,Acute lymphadenitis of face, head and neck,Disorder,SNOMED
4314426,HIV infection with acute lymphadenitis,Disorder,SNOMED
35208423,Acute lymphadenitis of other sites,4-char billing code,ICD10CM
44820624,Lymphosarcoma, lymph nodes of multiple sites,5-dig billing code,ICD9CM
318697,Lymphosarcoma of lymph nodes of multiple sites,Disorder,SNOMED
44824041,Other named variants of lymphosarcoma and reticulosarcoma, lymph nodes of multiple sites,5-dig billing code,ICD9CM
35206413,Lymphosarcoma, lymph nodes of multiple sites,5-char billing code,ICD10CM
318989,Leukemic reticuloendotheliosis of lymph nodes of multiple sites,Disorder,SNOMED
40386660,Leukemic reticuloendotheliosis of lymph nodes of multiple sites,Disorder,SNOMED
44832152,Leukemic reticuloendotheliosis, lymph nodes of multiple sites,5-dig billing code,ICD9CM
320317,Oculoglandular tularemia,Disorder,SNOMED
35205478,Oculoglandular tularemia,4-char billing code,ICD10CM
44822808,Oculoglandular tularemia,4-dig billing code,ICD9CM
320337,Hodgkin's granuloma of lymph nodes of multiple sites,Disorder,SNOMED
44822898,Hodgkin's granuloma, lymph nodes of multiple sites,5-dig billing code,ICD9CM
40648909,Hodgkin's granuloma of lymph nodes of multiple sites,Disorder,SNOMED
45552302,Follicular lymphoma, unspecified, lymph nodes of multiple sites,5-char billing code,ICD10CM
44821750,Nodular lymphoma, lymph nodes of multiple sites,5-dig billing code,ICD9CM
45600545,Cutaneous follicle center lymphoma, lymph nodes of multiple sites,5-char billing code,ICD10CM
320347,Nodular lymphoma of lymph nodes of multiple sites,Disorder,SNOMED
40386246,Nodular lymphoma of lymph nodes of multiple sites,Disorder,SNOMED
35206343,Other types of follicular non-Hodgkin's lymphoma, lymph nodes of multiple sites,5-char billing code,ICD10CM
45532950,Other types of follicular lymphoma, lymph nodes of multiple sites,5-char billing code,ICD10CM
321212,Bubonic plague,Disorder,SNOMED
35205470,Bubonic plague,4-char billing code,ICD10CM
44819349,Bubonic plague,4-dig billing code,ICD9CM
44829908,Sickle-cell thalassemia without crisis,5-dig billing code,ICD9CM
45561925,Sickle-cell thalassemia without crisis,5-char billing code,ICD10CM
725222,Sickle-cell thalassemia beta zero without crisis,5-char billing code,ICD10CM
321522,Hodgkin's disease, lymphocytic-histiocytic predominance of lymph nodes of multiple sites,Disorder,SNOMED
45595694,Nodular lymphocyte predominant Hodgkin lymphoma, lymph nodes of multiple sites,5-char billing code,ICD10CM
40648868,Hodgkin's disease, lymphocytic-histiocytic predominance of lymph nodes of multiple sites,Disorder,SNOMED
45600537,Lymphocyte-rich Hodgkin lymphoma, lymph nodes of multiple sites,5-char billing code,ICD10CM
44825224,Hodgkin's disease, lymphocytic-histiocytic predominance, lymph nodes of multiple sites,5-dig billing code,ICD9CM
44831018,Unspecified monocytic leukemia, in relapse,5-dig billing code,ICD9CM
45600569,Monocytic leukemia, unspecified, not having achieved remission,5-char billing code,ICD10CM
44829848,Other monocytic leukemia,4-dig nonbill code,ICD9CM
4094555,Monocytic leukemia NOS,Disorder,SNOMED
45581259,Other monocytic leukemia, in relapse,5-char billing code,ICD10CM
3537377,Other monocytic leukaemia NOS,Disorder,SNOMED
4299155,Leukemic infiltration of skin in monocytic leukemia,Disorder,SNOMED
45571575,Other monocytic leukemia, in remission,5-char billing code,ICD10CM
40385025,[M]Monocytic leukemia NOS,Disorder,SNOMED
40385374,[M]Aleukemic monocytic leukemia,Disorder,SNOMED
44833340,Other monocytic leukemia, in relapse,5-dig billing code,ICD9CM
44822912,Unspecified monocytic leukemia, without mention of having achieved remission,5-dig billing code,ICD9CM
40647634,Monocytic leukemia,Disorder,SNOMED
45561881,Monocytic leukemia, unspecified in remission,5-char billing code,ICD10CM
44831017,Monocytic leukemia,3-dig nonbill code,ICD9CM
44821502,Personal history of monocytic leukemia,5-dig billing V code,ICD9CM
1567703,Other monocytic leukemia,4-char nonbill code,ICD10CM
45542666,Monocytic leukemia, unspecified in relapse,5-char billing code,ICD10CM
4094553,Aleukemic monocytic leukemia,Disorder,SNOMED
1567704,Monocytic leukemia, unspecified,4-char nonbill code,ICD10CM
44825234,Other monocytic leukemia, without mention of having achieved remission,5-dig billing code,ICD9CM
1567699,Monocytic leukemia,3-char nonbill code,ICD10CM
45605334,Other monocytic leukemia, not having achieved remission,5-char billing code,ICD10CM
4176303,History of monocytic leukemia,Context-dependent,SNOMED
44832163,Unspecified monocytic leukemia,4-dig nonbill code,ICD9CM
3537378,Monocytic leukaemia NOS,Disorder,SNOMED
4094554,Other monocytic leukemia NOS,Disorder,SNOMED
4091926,Other monocytic leukemia,Disorder,SNOMED
321815,Malignant histiocytosis of lymph nodes of multiple sites,Disorder,SNOMED
44832150,Malignant histiocytosis, lymph nodes of multiple sites,5-dig billing code,ICD9CM
44834412,Tuberculosis of peripheral lymph nodes, bacteriological or histological examination not done,5-dig billing code,ICD9CM
44819342,Tuberculosis of peripheral lymph nodes, tubercle bacilli not found by bacteriological or histological examination, but tuberculosis confirmed by other methods [inoculation of animals],5-dig billing code,ICD9CM
35205461,Tuberculous peripheral lymphadenopathy,4-char billing code,ICD10CM
432236,Tuberculosis of peripheral lymph nodes,Disorder,SNOMED
3534965,Tuberculosis of peripheral lymph nodes NOS,Disorder,SNOMED
4091178,Tuberculosis of peripheral lymph nodes NOS,Disorder,SNOMED
44819340,Tuberculosis of peripheral lymph nodes, bacteriological or histological examination unknown (at present),5-dig billing code,ICD9CM
40382790,Tuberculosis of peripheral lymph nodes,Disorder,SNOMED
44823953,Tuberculosis of peripheral lymph nodes,4-dig nonbill code,ICD9CM
44819339,Tuberculosis of peripheral lymph nodes, unspecified,5-dig billing code,ICD9CM
44832061,Tuberculosis of peripheral lymph nodes, tubercle bacilli not found by bacteriological examination, but tuberculosis confirmed histologically,5-dig billing code,ICD9CM
44819341,Tuberculosis of peripheral lymph nodes, tubercle bacilli not found (in sputum) by microscopy, but found by bacterial culture,5-dig billing code,ICD9CM
44832060,Tuberculosis of peripheral lymph nodes, tubercle bacilli found (in sputum) by microscopy,5-dig billing code,ICD9CM
37162705,Primary squamous cell carcinoma of Waldeyer ring,Disorder,SNOMED
35206108,Malignant neoplasm of Waldeyer's ring,4-char billing code,ICD10CM
44827549,Malignant neoplasm of waldeyer's ring,4-dig billing code,ICD9CM
434289,Primary malignant neoplasm of lingual tonsil,Disorder,SNOMED
4246793,Primary malignant neoplasm of adenoid,Disorder,SNOMED
44797127,[X]Other chronic diseases of tonsils and adenoids,Disorder,SNOMED
4112505,Other chronic diseases of tonsils and adenoids NOS,Disorder,SNOMED
4112503,Other chronic diseases of tonsils and adenoids,Disorder,SNOMED
40395053,Chronic tonsil &/or adenoid disease,Disorder,SNOMED
40316077,Chronic tonsil and adenoid disease,Disorder,SNOMED
35207995,Other chronic diseases of tonsils and adenoids,4-char billing code,ICD10CM
44833601,Chronic disease of tonsils and adenoids,3-dig nonbill code,ICD9CM
4110497,Chronic tonsil and adenoid disease NOS,Disorder,SNOMED
35207996,Chronic disease of tonsils and adenoids, unspecified,4-char billing code,ICD10CM
44833603,Unspecified chronic disease of tonsils and adenoids,4-dig billing code,ICD9CM
1569479,Chronic diseases of tonsils and adenoids,3-char nonbill code,ICD10CM
4170139,Chronic adenoid disease,Disorder,SNOMED
3533960,Other chronic diseases of tonsils and adenoids NOS,Disorder,SNOMED
44833602,Other chronic disease of tonsils and adenoids,4-dig billing code,ICD9CM
3533959,Other chronic diseases of tonsils and adenoids,Disorder,SNOMED
40396952,[X]Other chronic diseases of tonsils and adenoids,Disorder,SNOMED
432347,Chronic disease of tonsils AND/OR adenoids,Disorder,SNOMED
40386167,Hodgkin's sarcoma of intrathoracic lymph nodes,Disorder,SNOMED
433156,Hodgkin's sarcoma of intrathoracic lymph nodes,Disorder,SNOMED
44826421,Hodgkin's sarcoma, intrathoracic lymph nodes,5-dig billing code,ICD9CM
44821789,Unspecified disease of thymus gland,4-dig billing code,ICD9CM
438122,Persistent hyperplasia of thymus,Disorder,SNOMED
4247081,Hemorrhage of thymus,Disorder,SNOMED
40288722,Disease of thymus gland, NEC,Disorder,SNOMED
44797513,[X]Other diseases of thymus,Disorder,SNOMED
44836920,Other specified diseases of thymus gland,4-dig billing code,ICD9CM
44831050,Diseases of thymus gland,3-dig nonbill code,ICD9CM
4096062,Other specified thymus disease NOS,Disorder,SNOMED
4096810,Thymus disease NOS,Disorder,SNOMED
4225549,Cyst of thymus gland,Disorder,SNOMED
40389569,[X]Other diseases of thymus,Disorder,SNOMED
35206954,Disease of thymus, unspecified,4-char billing code,ICD10CM
4130838,Neoplasm of thymus,Disorder,SNOMED
35206953,Other diseases of thymus,4-char billing code,ICD10CM
3537957,Other specified thymus disease,Disorder,SNOMED
4083843,Aplasia of thymus gland with immunodeficiency,Disorder,SNOMED
40351260,(Pituitary, parathyroid, thymus NOS) or (Forbes-Albright syndrome) or (pituitary hypofunction [& NOS]) or (Sheehan's syndrome) or (thymus disorder),Disorder,SNOMED
40321169,(Pituitary, parathyroid, thymus NOS) or (Forbes-Albright syndrome) or (pituitary hypofunction [& NOS]) or (Sheehan's syndrome) or (thymus disorder),Disorder,SNOMED
4301949,Congenital anomaly of the thymus,Disorder,SNOMED
433730,Disorder of thymus gland,Disorder,SNOMED
4031983,Atrophy of thymus gland,Disorder,SNOMED
4098736,Injury of thymus gland,Disorder,SNOMED
