CONCEPT_ID,CONCEPT_NAME,CONCEPT_CLASS_ID,CONCEPT_VOCAB_ID
35206321,Secondary and unspecified malignant neoplasm of intra-abdominal lymph nodes,4-char billing code,ICD10CM
44821737,Secondary and unspecified malignant neoplasm of intra-abdominal lymph nodes,4-dig billing code,ICD9CM
44825228,Other and unspecified malignant neoplasms of lymphoid and histiocytic tissue, intra-abdominal lymph nodes,5-dig billing code,ICD9CM
4131936,Neoplasm of intestinal lymph nodes,Disorder,SNOMED
4242807,Benign neoplasm of mesenteric lymph nodes,Disorder,SNOMED
4133605,Neoplasm of lateral axillary lymph nodes,Disorder,SNOMED
442252,Metastatic malignant neoplasm to axillary lymph nodes,Disorder,SNOMED
4242193,Benign neoplasm of axillary lymph nodes,Disorder,SNOMED
4314055,Metastatic malignant neoplasm to superficial inguinal lymph nodes,Disorder,SNOMED
4242968,Benign neoplasm of superficial inguinal lymph nodes,Disorder,SNOMED
4312303,Metastatic malignant neoplasm to femoral lymph nodes,Disorder,SNOMED
4241039,Benign neoplasm of femoral lymph nodes,Disorder,SNOMED
4242976,Benign neoplasm of tibial lymph nodes,Disorder,SNOMED
4314489,Metastatic malignant neoplasm to tibial lymph nodes,Disorder,SNOMED
4131427,Neoplasm of tibial lymph nodes,Disorder,SNOMED
44833307,Secondary and unspecified malignant neoplasm of intrapelvic lymph nodes,4-dig billing code,ICD9CM
35206324,Secondary and unspecified malignant neoplasm of intrapelvic lymph nodes,4-char billing code,ICD10CM
4133607,Neoplasm of parametrial lymph nodes,Disorder,SNOMED
44835711,Other and unspecified malignant neoplasms of lymphoid and histiocytic tissue, intrapelvic lymph nodes,5-dig billing code,ICD9CM
4131921,Parotid lymphadenopathy,Disorder,SNOMED
4131922,Submental lymphadenopathy,Disorder,SNOMED
40304557,O/E-sub-mental lymphadenopathy,Clinical Finding,SNOMED
4062589,O/E-sub-mental lymphadenopathy,Disorder,SNOMED
4131923,Mandibular lymphadenopathy,Disorder,SNOMED
40647629,Mixed cell type lymphosarcoma of lymph nodes of multiple sites,Disorder,SNOMED
40647539,Lymphosarcoma of lymph nodes of multiple sites,Disorder,SNOMED
4317837,Neoplasm of uncertain behavior of Waldeyer's ring,Disorder,SNOMED
4242035,Carcinoma in situ of Waldeyer's ring,Disorder,SNOMED
40462825,Tumor of Waldeyer's ring,Disorder,SNOMED
4315659,Metastatic malignant neoplasm to parotid lymph nodes,Disorder,SNOMED
4243566,Benign neoplasm of parotid lymph nodes,Disorder,SNOMED
4131933,Neoplasm of parotid lymph nodes,Disorder,SNOMED
4240175,Benign neoplasm of submental lymph nodes,Disorder,SNOMED
4314054,Metastatic malignant neoplasm to submental lymph nodes,Disorder,SNOMED
4243577,Benign neoplasm of retropharyngeal lymph nodes,Disorder,SNOMED
4314341,Metastatic malignant neoplasm to retropharyngeal lymph nodes,Disorder,SNOMED
4242506,Benign neoplasm of retroperitoneal lymph nodes,Disorder,SNOMED
4094541,Mast cell malignancy of lymph nodes of inguinal region and lower limb,Disorder,SNOMED
37165850,Letterer-Siwe disease of lymph nodes of lower limb,Disorder,SNOMED
37165860,Malignant mast cell tumor of lymph nodes of lower limb,Disorder,SNOMED
4131939,Neoplasm of popliteal lymph nodes,Disorder,SNOMED
444465,Letterer-Siwe disease of lymph nodes of inguinal region AND/OR lower limb,Disorder,SNOMED
44821755,Other and unspecified malignant neoplasms of lymphoid and histiocytic tissue, lymph nodes of inguinal region and lower limb,5-dig billing code,ICD9CM
44829821,Secondary and unspecified malignant neoplasm of lymph nodes of inguinal region and lower limb,4-dig billing code,ICD9CM
4311211,Metastatic malignant neoplasm to popliteal lymph nodes,Disorder,SNOMED
4240042,Benign neoplasm of popliteal lymph nodes,Disorder,SNOMED
44828745,Secondary and unspecified malignant neoplasm of lymph nodes of multiple sites,4-dig billing code,ICD9CM
44828756,Other and unspecified malignant neoplasms of lymphoid and histiocytic tissue, lymph nodes of multiple sites,5-dig billing code,ICD9CM
4064312,O/E -cervical lymphadenopathy,Disorder,SNOMED
4133461,Anterior cervical lymphadenopathy,Disorder,SNOMED
40304556,O/E -cervical lymphadenopathy,Clinical Finding,SNOMED
4133468,Esophageal lymphadenopathy,Disorder,SNOMED
4133583,Lumbar lymphadenopathy,Disorder,SNOMED
4133592,Promontory lymphadenopathy,Disorder,SNOMED
4133589,Retrocecal lymphadenopathy,Disorder,SNOMED
4133588,Prececal lymphadenopathy,Disorder,SNOMED
45566649,Chronic myelomonocytic leukemia, in remission,5-char billing code,ICD10CM
40387137,Chronic myelomonocytic leukemia,Disorder,SNOMED
44826433,Monocytic leukemia, chronic,4-dig nonbill code,ICD9CM
45557046,Chronic myelomonocytic leukemia not having achieved remission,5-char billing code,ICD10CM
40385372,[M]Chronic monocytic leukemia,Disorder,SNOMED
1567701,Chronic myelomonocytic leukemia,4-char nonbill code,ICD10CM
44834521,Chronic monocytic leukemia, without mention of having achieved remission,5-dig billing code,ICD9CM
45600567,Chronic myelomonocytic leukemia, in relapse,5-char billing code,ICD10CM
4241911,Carcinoma in situ of spleen,Disorder,SNOMED
44834516,Other and unspecified malignant neoplasms of lymphoid and histiocytic tissue, spleen,5-dig billing code,ICD9CM
4133600,Neoplasm of spleen,Disorder,SNOMED
4315946,Neoplasm of uncertain behavior of spleen,Disorder,SNOMED
4242523,Benign neoplasm of spleen,Disorder,SNOMED
4240019,Benign neoplasm of lymph nodes of face,Disorder,SNOMED
440341,Metastatic malignant neoplasm to lymph nodes of face,Disorder,SNOMED
4242502,Benign neoplasm of preauricular lymph nodes,Disorder,SNOMED
4311320,Metastatic malignant neoplasm to preauricular lymph nodes,Disorder,SNOMED
4314485,Metastatic malignant neoplasm to supraclavicular lymph nodes,Disorder,SNOMED
4240176,Benign neoplasm of supraclavicular lymph nodes,Disorder,SNOMED
4241658,Benign neoplasm of tracheobronchial lymph nodes,Disorder,SNOMED
4314067,Metastatic malignant neoplasm to tracheobronchial lymph nodes,Disorder,SNOMED
4241019,Benign neoplasm of lateral axillary lymph nodes,Disorder,SNOMED
4234267,Metastatic malignant neoplasm to lateral axillary lymph nodes,Disorder,SNOMED
4312950,Metastatic malignant neoplasm to epitrochlear lymph nodes,Disorder,SNOMED
4239879,Benign neoplasm of epitrochlear lymph nodes,Disorder,SNOMED
4315657,Metastatic malignant neoplasm to parametrial lymph nodes,Disorder,SNOMED
4243564,Benign neoplasm of parametrial lymph nodes,Disorder,SNOMED
40293600,Abdominal lymphadenopathy,Disorder,SNOMED
4130822,Subiliac lymphadenopathy,Disorder,SNOMED
45547557,Acute promyelocytic leukemia, in remission,5-char billing code,ICD10CM
44833337,Subacute lymphoid leukemia, in remission,5-dig billing code,ICD9CM
44833341,Acute erythremia and erythroleukemia, in remission,5-dig billing code,ICD9CM
45571577,Acute erythroid leukemia, in remission,5-char billing code,ICD10CM
40649179,Acute erythremia in remission,Disorder,SNOMED
4141589,Abscess of tonsil,Disorder,SNOMED
4143679,Hodgkin's disease, lymphocytic depletion of lymph nodes of head,Disorder,SNOMED
44829836,Hodgkin's disease, lymphocytic depletion, lymph nodes of head, face, and neck,5-dig billing code,ICD9CM
433161,Hodgkin's disease, lymphocytic depletion of lymph nodes of head, face AND/OR neck,Disorder,SNOMED
44832158,Subacute myeloid leukemia,in remission,5-dig billing code,ICD9CM
44822913,Subacute leukemia of unspecified cell type, in remission,5-dig billing code,ICD9CM
40390944,Bone marrow depression,Disorder,SNOMED
40615409,Hypoplasia of bone marrow,Disorder,SNOMED
40529748,Familial hemophagocytic lymphohistiocytosis,Disorder,SNOMED
40432416,Familial erythrophagocytic lymphohistiocytosis,Disorder,SNOMED
40390895,Familial erythrophagocytic lymphohistiocytosis,Disorder,SNOMED
40390408,(Constitutional aplastic anemia with malformation) or (pancytopenia - dysmelia),Disorder,SNOMED
40390405,(Anemia: [constitutional aplastic] or [familial hypoplastic]) or (pancytopenia with malformations) or (Blackfan - Diamond syndrome),Disorder,SNOMED
4146088,Aplastic anemia due to drugs,Disorder,SNOMED
40651694,Aplastic anemia secondary to drugs,Disorder,SNOMED
37016151,Aplastic anemia caused by antineoplastic agent,Disorder,SNOMED
40390416,Anemia: [aplastic due to drugs] or [hypoplastic due to drug or chemical substance],Disorder,SNOMED
35206744,Drug-induced aplastic anemia,4-char billing code,ICD10CM
4147317,Cutaneous mastocytosis, adult form,Disorder,SNOMED
44832217,Nonspecific mesenteric lymphadenitis,4-dig billing code,ICD9CM
35207907,Nonspecific mesenteric lymphadenitis,4-char billing code,ICD10CM
4100243,Nonspecific mesenteric lymphadenitis NOS,Disorder,SNOMED
3533308,Nonspecific mesenteric lymphadenitis NOS,Disorder,SNOMED
37397178,PFAPA syndrome,Disorder,SNOMED
35207994,Hypertrophy of tonsils with hypertrophy of adenoids,4-char billing code,ICD10CM
4077348,Pancytopenia-dysmelia,Disorder,SNOMED
40479638,History of Fanconi anemia,Context-dependent,SNOMED
1102626,Fanconi anemia,5-char billing code,ICD10CM
4188208,Estren-Dameshek anemia,Disorder,SNOMED
37168560,Fanconi anemia of complementation group C,Disorder,SNOMED
4148545,Cervical thymic remnant,Disorder,SNOMED
40395067,Cyst of tonsil,Disorder,SNOMED
4150803,Spleen rupture due to birth trauma,Disorder,SNOMED
40404960,Spleen injury due to birth trauma (& [rupture]),Disorder,SNOMED
4128030,Delivery procedure,Procedure,SNOMED
40531935,Rupture of spleen as birth trauma,Disorder,SNOMED
4155627,Lymph node injury,Disorder,SNOMED
4158909,Tonsil carcinoma,Disorder,SNOMED
40320135,(Ca oro/naso/hypopharynx) or (carcinoma: [pharynx] or [tonsil]),Disorder,SNOMED
40352496,(Ca oro/naso/hypopharynx) or (carcinoma: [pharynx] or [tonsil]),Disorder,SNOMED
40282772,Renal function,Observable Entity,SNOMED
4197185,Hyperacute rejection of bone marrow transplant,Disorder,SNOMED
4118567,[D]Generalized enlarged lymph nodes,Context-dependent,SNOMED
35211398,Generalized enlarged lymph nodes,4-char billing code,ICD10CM
4165998,Generalized enlarged lymph nodes,Disorder,SNOMED
44802987,[D]Generalised enlarged lymph nodes,Context-dependent,SNOMED
4200196,No generalized lymphadenopathy,Context-dependent,SNOMED
4167552,Littoral cell angioma,Disorder,SNOMED
4168030,Hypertrophy of lingual tonsil,Disorder,SNOMED
44802988,[D]Localised enlarged lymph nodes,Context-dependent,SNOMED
35211397,Localized enlarged lymph nodes,4-char billing code,ICD10CM
4118754,[D]Localized enlarged lymph nodes,Context-dependent,SNOMED
4199554,No localized lymphadenopathy,Context-dependent,SNOMED
35210476,Birth injury to spleen,4-char billing code,ICD10CM
1567682,Chronic lymphocytic leukemia of B-cell type,4-char nonbill code,ICD10CM
45571568,Chronic lymphocytic leukemia of B-cell type not having achieved remission,5-char billing code,ICD10CM
45566648,Mature B-cell leukemia Burkitt-type,4-char nonbill code,ICD10CM
3545393,B-cell acute lymphoblastic leukaemia,Undefined,SNOMED
45547553,Mature B-cell leukemia Burkitt-type, in relapse,5-char billing code,ICD10CM
45537875,Mature B-cell leukemia Burkitt-type, in remission,5-char billing code,ICD10CM
45590965,Mature B-cell leukemia Burkitt-type not having achieved remission,5-char billing code,ICD10CM
4173970,Malignant myeloid/lymphoid neoplasm,Disorder,SNOMED
45552311,Prolymphocytic leukemia of B-cell type, in relapse,5-char billing code,ICD10CM
1567683,Prolymphocytic leukemia of B-cell type,4-char nonbill code,ICD10CM
3545395,B-cell prolymphocytic leukaemia,Undefined,SNOMED
45571569,Prolymphocytic leukemia of B-cell type, in remission,5-char billing code,ICD10CM
45532958,Prolymphocytic leukemia of B-cell type not having achieved remission,5-char billing code,ICD10CM
45771284,Therapy-related myelodysplastic syndrome,Disorder,SNOMED
40481339,Thrombophilia due to myeloproliferative disorder,Disorder,SNOMED
40387141,Myeloproliferative disorder,Disorder,SNOMED
3524758,Myeloproliferative disorder,Disorder,SNOMED
37164750,Isolated bone marrow mastocytosis,Disorder,SNOMED
36715588,Transient abnormal myelopoiesis,Disorder,SNOMED
37165203,Occlusion of microvasculature of skin due to myeloproliferative disorder-associated platelet plugs,Disorder,SNOMED
44783634,Pulmonary hypertension due to myeloproliferative disorder,Disorder,SNOMED
606413,Vasculitis due to myeloproliferative disorder,Disorder,SNOMED
4177177,Cellular immunologic aplastic anemia,Disorder,SNOMED
4223797,Hyperplasia of tonsils AND adenoids,Disorder,SNOMED
43531504,MRI of chest for hilar and mediastinal lymphadenopathy,Procedure,SNOMED
43531502,MRI of chest for mediastinal lymphadenopathy,Procedure,SNOMED
4248070,Metastatic malignant neoplasm to lingual tonsil,Disorder,SNOMED
4089669,Malignant neoplasm of spleen NOS,Disorder,SNOMED
442173,Metastatic malignant neoplasm to spleen,Disorder,SNOMED
4092082,Malignant neoplasm of spleen NEC,Disorder,SNOMED
3539542,Malignant neoplasm of spleen NOS,Disorder,SNOMED
3531386,Malignant neoplasm of spleen NEC,Disorder,SNOMED
40381364,Malignant neoplasm of palatine tonsil,Disorder,SNOMED
40381363,Malignant neoplasm of faucial tonsil,Disorder,SNOMED
4094719,Malignant neoplasm tonsil NOS,Disorder,SNOMED
40486637,Non-Hodgkin's lymphoma of tonsil,Disorder,SNOMED
4315549,Metastatic malignant neoplasm to tonsil,Disorder,SNOMED
46273418,History of malignant neoplasm of tonsil,Context-dependent,SNOMED
4184174,Fibrotic lymphadenopathy,Disorder,SNOMED
4211348,Aplastic anemia associated with pancreatitis,Disorder,SNOMED
4187773,Aplastic anemia associated with pregnancy,Disorder,SNOMED
4147492,Acquired aplastic anemia NOS,Disorder,SNOMED
40321697,Acquired aplastic anemia,Disorder,SNOMED
40351309,Acquired aplastic anemia,Disorder,SNOMED
4185301,Chronic myeloid leukemia in myeloid blast crisis,Disorder,SNOMED
40618302,Aplastic anemia secondary to metabolic alteration,Disorder,SNOMED
436670,Metabolic disease,Disorder,SNOMED
4246450,Metastatic malignant neoplasm to bone marrow,Disorder,SNOMED
45591008,Refractory anemia with excess of blasts 2,5-char billing code,ICD10CM
40488644,Aplastic anemia secondary to pregnancy,Disorder,SNOMED
4188973,Chronic myeloid leukemia in lymphoid blast crisis,Disorder,SNOMED
45557082,Refractory anemia with excess of blasts 1,5-char billing code,ICD10CM
35206783,Cyst of spleen,4-char billing code,ICD10CM
35609024,Chronic osteomyelitis of right tibia,Disorder,SNOMED
35609025,Chronic osteomyelitis of left tibia,Disorder,SNOMED
36715818,Pharyngotonsillitis caused by Human herpes simplex virus,Disorder,SNOMED
4312636,Tonsillar actinomycosis,Disorder,SNOMED
40264464,Tuberculosis of cervical lymph nodes,Disorder,SNOMED
4208548,Tonsillar tag,Disorder,SNOMED
40390928,Splenic fibrosis,Disorder,SNOMED
4209431,Splenic fibrosis,Disorder,SNOMED
1567879,Postprocedural hemorrhage of the spleen following a procedure,4-char nonbill code,ICD10CM
45547614,Intraoperative hemorrhage and hematoma of the spleen complicating a procedure on the spleen,5-char billing code,ICD10CM
45542719,Postprocedural hemorrhage of the spleen following a procedure on the spleen,5-char billing code,ICD10CM
45532999,Intraoperative hemorrhage and hematoma of the spleen complicating other procedure,5-char billing code,ICD10CM
37200018,Postprocedural hematoma of the spleen following other procedure,5-char billing code,ICD10CM
37200017,Postprocedural hematoma of the spleen following a procedure on the spleen,5-char billing code,ICD10CM
45576419,Postprocedural hemorrhage of the spleen following other procedure,5-char billing code,ICD10CM
1567877,Intraoperative hemorrhage and hematoma of the spleen complicating a procedure,4-char nonbill code,ICD10CM
36717593,Neonatal hemorrhage of spleen,Disorder,SNOMED
40366890,Congenital syphilitic splenomegaly,Disorder,SNOMED
4210320,Congenital syphilitic splenomegaly,Disorder,SNOMED
40523926,Aplastic anemia secondary to pancreatitis,Disorder,SNOMED
4192640,Pancreatitis,Disorder,SNOMED
4211426,Signal node,Disorder,SNOMED
40630092,Virchow's node,Disorder,SNOMED
4264694,Systemic mastocytosis with associated clonal hematological non-mast cell lineage disease,Disorder,SNOMED
45543253,Acute streptococcal tonsillitis, unspecified,5-char billing code,ICD10CM
1569449,Streptococcal tonsillitis,4-char nonbill code,ICD10CM
4214373,Neonatal hepatosplenomegaly,Disorder,SNOMED
4308585,Neonatal osteomyelitis of jaw,Disorder,SNOMED
40441138,Pelvis acute osteomyelitis,Disorder,SNOMED
4269229,Localized extracutaneous mastocytosis,Disorder,SNOMED
766347,Hereditary alpha tryptasemia,5-char billing code,ICD10CM
4217370,Aase syndrome,Disorder,SNOMED
40410702,Mycosis leptothrica,Disorder,SNOMED
4345712,Fusobacterial necrotizing tonsillitis,Disorder,SNOMED
4310093,Tuberculosis of tracheobronchial lymph nodes,Disorder,SNOMED
4219464,Telangiectasia macularis eruptiva perstans,Disorder,SNOMED
40625218,Urticaria pigmentosa, telangiectasia macularis eruptiva perstans,Disorder,SNOMED
35206782,Abscess of spleen,4-char billing code,ICD10CM
4220074,Splenic abscess,Disorder,SNOMED
4220553,Virchow's node,Disorder,SNOMED
40522596,AIDS with hematopoietic system disease,Disorder,SNOMED
4227511,Lymphadenopathy associated with AIDS,Disorder,SNOMED
4225810,Aplastic anemia with AIDS (acquired immunodeficiency syndrome),Disorder,SNOMED
4223656,Suppurative osteomyelitis of jaw,Disorder,SNOMED
40642744,AIDS with aplastic anemia,Disorder,SNOMED
4043761,Bone marrow examination,Procedure,SNOMED
40386214,Chronic constitutional pure red cell aplasia,Disorder,SNOMED
40480011,History of Diamond-Blackfan anemia,Context-dependent,SNOMED
4101581,Erythrogenesis imperfecta,Disorder,SNOMED
40390409,(Red cell: [constitutional aplasia or hypoplasia] or [congenital pure aplasia] or [congenital hypoplasia]) or (Blackfan - Diamond syndrome),Disorder,SNOMED
4125497,Congenital red cell hypoplasia,Disorder,SNOMED
40368094,Acute myeloblastic leukemia without maturation,Disorder,SNOMED
40538561,Acute myelogenous leukemia without maturation, FAB M1,Disorder,SNOMED
40294171,Acute myeloid leukemia without maturation, FAB M1,Disorder,SNOMED
40368091,Acute myeloblastic leukemia - undifferentiated,Disorder,SNOMED
40294170,Acute myeloid leukemia, minimal differentiation, FAB M0,Disorder,SNOMED
40538550,Acute myelogenous leukemia without differentiation, FAB M0,Disorder,SNOMED
43021166,History of tonsillitis,Context-dependent,SNOMED
3519342,History of tonsillitis,Context-dependent,SNOMED
40368096,Acute myeloblastic leukemia with maturation,Disorder,SNOMED
40294172,Acute myeloid leukemia with maturation, FAB M2,Disorder,SNOMED
40538571,Acute myelogenous leukemia with maturation, FAB M2,Disorder,SNOMED
40390426,Chronic acquired pure red cell aplasia,Disorder,SNOMED
35206740,Chronic acquired pure red cell aplasia,4-char billing code,ICD10CM
40442150,Tuberculosis of bone,Disorder,SNOMED
4239485,Tuberculous osteomyelitis,Disorder,SNOMED
40389179,DiGeorge syndrome,Disorder,SNOMED
4239718,Congenital absence of thymus,Disorder,SNOMED
40387174,Benign tumor of adenoid,Disorder,SNOMED
4239893,Benign neoplasm of hypogastric lymph nodes,Disorder,SNOMED
4242492,Benign neoplasm of pararectal lymph nodes,Disorder,SNOMED
4243415,Benign neoplasm of iliac lymph nodes,Disorder,SNOMED
40395064,Cicatrix of adenoid,Clinical Finding,SNOMED
40389061,Carcinoma in situ of spleen,Disorder,SNOMED
4246666,Hemangioma of spleen,Disorder,SNOMED
4242866,Functional asplenia,Disorder,SNOMED
40462826,Benign tumor of Waldeyer's ring,Disorder,SNOMED
4243109,Congenital cleft of thymus,Disorder,SNOMED
4069846,Bilateral right-sidedness sequence,Disorder,SNOMED
45577768,Asplenia (congenital),5-char billing code,ICD10CM
37111653,Familial isolated congenital asplenia,Disorder,SNOMED
40402383,(Absent spleen) or (asplenia),Disorder,SNOMED
762394,Family history of asplenia,Context-dependent,SNOMED
37163587,Diaphragmatic hernia, short bowel, asplenia syndrome,Disorder,SNOMED
4244934,Congenital abnormal shape of thymus,Disorder,SNOMED
40297840,Congenital cyst of spleen,Disorder,SNOMED
44828754,Leukemic reticuloendotheliosis, spleen,5-dig billing code,ICD9CM
40405663,Synovitis, acne, pustulosis palmaris, hyperostosis, osteomyelitis syndrome,Disorder,SNOMED
44831007,Malignant mast cell tumors, intra-abdominal lymph nodes,5-dig billing code,ICD9CM
4287318,Diffuse erythrodermic mastocytosis,Disorder,SNOMED
1326488,Cutaneous mastocytosis,5-char billing code,ICD10CM
4297865,Cutaneous mastocytosis, infantile form,Disorder,SNOMED
4299274,Familial mastocytosis,Disorder,SNOMED
36716445,Hennekam Beemer syndrome,Disorder,SNOMED
40401884,Urticaria pigmentosa,Disorder,SNOMED
4264113,Solitary cutaneous mastocytoma,Disorder,SNOMED
4187925,Urticaria pigmentosa, multiple nodules AND/OR plaques,Disorder,SNOMED
4194218,Urticaria pigmentosa, maculopapular type,Disorder,SNOMED
4301784,Bullous cutaneous mastocytosis,Disorder,SNOMED
4246571,Congenital malposition of thymus,Disorder,SNOMED
36716502,Primary squamous cell carcinoma of pharyngeal tonsil,Disorder,SNOMED
4246931,Congenital hypoplasia of thymus,Disorder,SNOMED
40490513,Spleen in right sided position,Disorder,SNOMED
4003185,Refractory anemia (clinical),Disorder,SNOMED
4247909,Bilateral left-sidedness sequence,Disorder,SNOMED
45769886,Polysplenia heterotaxy syndrome,Disorder,SNOMED
4256125,Q fever osteomyelitis,Disorder,SNOMED
45769384,Congenital pulmonary lymphatic dysplasia syndrome,Disorder,SNOMED
254443,Sjgren's syndrome,Disorder,SNOMED
40481127,Hypertrophy of thymus,Disorder,SNOMED
4327862,Osteomyelitis caused by Staphylococcus aureus,Disorder,SNOMED
45757249,Gonococcal osteomyelitis,Disorder,SNOMED
37161447,Osteomyelitis caused by Salmonella enterica enterica serovar Typhi,Disorder,SNOMED
36715428,Pasteurella multocida osteomyelitis,Disorder,SNOMED
40644493,Urticaria pigmentosa, solitary cutaneous nodule,Disorder,SNOMED
37111662,Splenogonadal fusion, limb defect, micrognathia syndrome,Disorder,SNOMED
40455129,Epithelioid hemangioma of skin,Disorder,SNOMED
4298133,Epithelioid hemangioma involving ear,Disorder,SNOMED
4267788,Dermatopathic lymphadenitis,Disorder,SNOMED
3571499,Kimura's disease,Disorder,SNOMED
40406095,Brodie's abscess,Disorder,SNOMED
40402384,(Congenital) or (acquired) splenomegaly,Disorder,SNOMED
40355255,Congenital splenomegaly,Disorder,SNOMED
36675176,Thrombocythemia with distal limb defect,Disorder,SNOMED
35206834,Sarcoidosis of lymph nodes,4-char billing code,ICD10CM
40379159,Lymph node sarcoidosis,Disorder,SNOMED
40402385,Ectopic spleen,Clinical Finding,SNOMED
4007568,Aberrant spleen,Disorder,SNOMED
44812739,[X] Hepatomegaly with splenomegaly, not elsewhere classified,Disorder,SNOMED
40353441,[X] Hepatomegaly with splenomegaly, not elsewhere classified,Disorder,SNOMED
35211297,Hepatomegaly with splenomegaly, not elsewhere classified,4-char billing code,ICD10CM
40395060,Cicatrix of tonsil,Clinical Finding,SNOMED
1571202,Subacute osteomyelitis,4-char nonbill code,ICD10CM
45596775,Subacute osteomyelitis, unspecified site,5-char billing code,ICD10CM
45592038,Subacute osteomyelitis, other site,5-char billing code,ICD10CM
37109010,Subacute osteomyelitis of left foot,Disorder,SNOMED
45558073,Subacute osteomyelitis, multiple sites,5-char billing code,ICD10CM
37117085,Subacute osteomyelitis of right foot,Disorder,SNOMED
40406494,Subacute osteomyelitis,Disorder,SNOMED
40468073,Urticaria pigmentosa, diffuse erythrodermic type,Disorder,SNOMED
46273416,Acute adenoiditis,Disorder,SNOMED
37164708,Parinaud oculoglandular syndrome,Disorder,SNOMED
4062590,On examination - supraclavicular lymphadenopathy,Disorder,SNOMED
4209041,Sentinel node,Disorder,SNOMED
36713269,Focal lymphadenopathy,Disorder,SNOMED
37163031,Acute cervical lymphadenitis,Disorder,SNOMED
44795689,[X]Diseases of veins, lymphatic vessels and lymph nodes, not elsewhere classified,Disorder,SNOMED
4297355,Aggressive NK-cell leukemia involving skin,Disorder,SNOMED
4082350,Drug-induced pseudolymphomatous eruption,Disorder,SNOMED
141831,DiGeorge sequence,Disorder,SNOMED
37109722,Thymic, renal, anal, lung dysplasia syndrome,Disorder,SNOMED
3537698,Anomaly of thymus gland NOS,Disorder,SNOMED
4007575,Anomaly of thymus gland NOS,Disorder,SNOMED
35206677,Chronic myeloproliferative disease,4-char billing code,ICD10CM
40441147,Neonatal osteomyelitis of jaw,Disorder,SNOMED
40647535,Lymphosarcoma of intrathoracic lymph nodes,Disorder,SNOMED
40647533,Lymphosarcoma of intra-abdominal lymph nodes,Disorder,SNOMED
40263069,HIV infection with acute lymphadenitis,Disorder,SNOMED
40260457,AIDS virus with acute lymphadenitis,Disorder,SNOMED
40397995,Inflammatory jaw conditions (& [osteitis] or [osteomyelitis]),Disorder,SNOMED
40389881,Neoplasm of uncertain behavior of spleen,Disorder,SNOMED
4296153,Craniectomy for osteomyelitis,Procedure,SNOMED
37166460,Leak of cranial cerebrospinal fluid due to osteomyelitis,Disorder,SNOMED
4043445,Bone marrow myeloid hyperplasia,Clinical Finding,SNOMED
40312160,Bone marrow:myeloid hyperplas.,Clinical Finding,SNOMED
3546469,Macrophage activation syndrome,Undefined,SNOMED
37162801,Periodic fever, infantile enterocolitis, autoinflammatory syndrome,Disorder,SNOMED
3546468,Macrophage activation syndrome,Disorder,SNOMED
43531501,MRI of chest for hilar lymphadenopathy,Procedure,SNOMED
4131269,Bronchopulmonary lymphadenopathy,Disorder,SNOMED
37108667,Chronic osteomyelitis of left foot,Disorder,SNOMED
37117198,Chronic osteomyelitis of right foot,Disorder,SNOMED
45587172,Chronic multifocal osteomyelitis, unspecified femur,6-char billing code,ICD10CM
42539293,Chronic osteomyelitis of right femur,Disorder,SNOMED
45587171,Chronic multifocal osteomyelitis, right femur,6-char billing code,ICD10CM
45572644,Chronic multifocal osteomyelitis, left femur,6-char billing code,ICD10CM
42534898,Chronic osteomyelitis of left femur,Disorder,SNOMED
40530127,Chronic osteomyelitis of thigh,Disorder,SNOMED
4347562,Splenic schistosomal giant cell lymphoma,Disorder,SNOMED
37117154,Acute osteomyelitis of left foot,Disorder,SNOMED
37108666,Acute osteomyelitis of right foot,Disorder,SNOMED
40383335,Fusobacterial necrotizing tonsillitis,Disorder,SNOMED
46270392,Chronic osteomyelitis of ankle with draining sinus,Disorder,SNOMED
