"DX_CODE_2","CODE","SHORT_DESCRIPTION","LONG_DESCRIPTION","CONCEPT_ID","CONCEPT_NAME","DOMAIN_ID","VOCABULARY_ID","CONCEPT_CLASS_ID","START_DATE","END_DATE"
"Z49",NA,NA,NA,1576113,"Encounter for care involving renal dialysis","Observation","ICD10CM","3-char nonbill code","2012-01-01","2099-12-31"
"Z49.0",NA,NA,NA,1576114,"Preparatory care for renal dialysis","Observation","ICD10CM","4-char nonbill code","2012-01-01","2099-12-31"
"Z49.01",NA,NA,NA,45609945,"Encounter for fitting and adjustment of extracorporeal dialysis catheter","Observation","ICD10CM","5-char billing code","1970-01-01","2099-12-31"
"Z49.02",NA,NA,NA,45585835,"Encounter for fitting and adjustment of peritoneal dialysis catheter","Observation","ICD10CM","5-char billing code","1970-01-01","2099-12-31"
"Z49.3",NA,NA,NA,1576115,"Encounter for adequacy testing for dialysis","Observation","ICD10CM","4-char nonbill code","2012-01-01","2099-12-31"
"Z49.31",NA,NA,NA,45556841,"Encounter for adequacy testing for hemodialysis","Observation","ICD10CM","5-char billing code","1970-01-01","2099-12-31"
"Z49.32",NA,NA,NA,45566436,"Encounter for adequacy testing for peritoneal dialysis","Observation","ICD10CM","5-char billing code","1970-01-01","2099-12-31"
