"DX_CODE_2","CODE","SHORT_DESCRIPTION","LONG_DESCRIPTION","CONCEPT_ID","CONCEPT_NAME","DOMAIN_ID","VOCABULARY_ID","CONCEPT_CLASS_ID","START_DATE","END_DATE"
"O07.4","O074","Failed attempted termination of pregnancy w/o complication","Failed attempted termination of pregnancy without complication",35209539,"Failed attempted termination of pregnancy without complication","Condition","ICD10CM","4-char billing code","2007-01-01","2099-12-31"
"O08",NA,NA,NA,1571612,"Complications following ectopic and molar pregnancy","Condition","ICD10CM","3-char nonbill code","2012-01-01","2099-12-31"
"O08.0","O080","Genitl trct and pelvic infct fol ectopic and molar pregnancy","Genital tract and pelvic infection following ectopic and molar pregnancy",35209540,"Genital tract and pelvic infection following ectopic and molar pregnancy","Condition","ICD10CM","4-char billing code","2007-01-01","2099-12-31"
"O08.1","O081","Delayed or excess hemor fol ectopic and molar pregnancy","Delayed or excessive hemorrhage following ectopic and molar pregnancy",35209541,"Delayed or excessive hemorrhage following ectopic and molar pregnancy","Condition","ICD10CM","4-char billing code","2007-01-01","2099-12-31"
"O08.2","O082","Embolism following ectopic and molar pregnancy","Embolism following ectopic and molar pregnancy",35209542,"Embolism following ectopic and molar pregnancy","Condition","ICD10CM","4-char billing code","2007-01-01","2099-12-31"
"O08.3","O083","Shock following ectopic and molar pregnancy","Shock following ectopic and molar pregnancy",35209543,"Shock following ectopic and molar pregnancy","Condition","ICD10CM","4-char billing code","2007-01-01","2099-12-31"
"O08.4","O084","Renal failure following ectopic and molar pregnancy","Renal failure following ectopic and molar pregnancy",35209544,"Renal failure following ectopic and molar pregnancy","Condition","ICD10CM","4-char billing code","2007-01-01","2099-12-31"
"O08.5","O085","Metabolic disorders following an ectopic and molar pregnancy","Metabolic disorders following an ectopic and molar pregnancy",35209545,"Metabolic disorders following an ectopic and molar pregnancy","Condition","ICD10CM","4-char billing code","2007-01-01","2099-12-31"
"O08.6","O086","Damage to pelvic organs and tiss fol an ect and molar preg","Damage to pelvic organs and tissues following an ectopic and molar pregnancy",35209546,"Damage to pelvic organs and tissues following an ectopic and molar pregnancy","Condition","ICD10CM","4-char billing code","2007-01-01","2099-12-31"
"O08.7","O087","Oth venous comp following an ectopic and molar pregnancy","Other venous complications following an ectopic and molar pregnancy",35209547,"Other venous complications following an ectopic and molar pregnancy","Condition","ICD10CM","4-char billing code","2007-01-01","2099-12-31"
"O08.8",NA,NA,NA,1571613,"Other complications following an ectopic and molar pregnancy","Condition","ICD10CM","4-char nonbill code","2012-01-01","2099-12-31"
"O08.81","O0881","Cardiac arrest following an ectopic and molar pregnancy","Cardiac arrest following an ectopic and molar pregnancy",45563042,"Cardiac arrest following an ectopic and molar pregnancy","Condition","ICD10CM","5-char billing code","1970-01-01","2099-12-31"
"O08.82","O0882","Sepsis following ectopic and molar pregnancy","Sepsis following ectopic and molar pregnancy",45601772,"Sepsis following ectopic and molar pregnancy","Condition","ICD10CM","5-char billing code","1970-01-01","2099-12-31"
"O08.83","O0883","Urinary tract infection fol an ectopic and molar pregnancy","Urinary tract infection following an ectopic and molar pregnancy",45534163,"Urinary tract infection following an ectopic and molar pregnancy","Condition","ICD10CM","5-char billing code","1970-01-01","2099-12-31"
"O08.89","O0889","Other complications following an ectopic and molar pregnancy","Other complications following an ectopic and molar pregnancy",45596911,"Other complications following an ectopic and molar pregnancy","Condition","ICD10CM","5-char billing code","1970-01-01","2099-12-31"
"O08.9","O089","Unsp complication following an ectopic and molar pregnancy","Unspecified complication following an ectopic and molar pregnancy",35209548,"Unspecified complication following an ectopic and molar pregnancy","Condition","ICD10CM","4-char billing code","2007-01-01","2099-12-31"
"O80",NA,NA,NA,35210362,"Encounter for full-term uncomplicated delivery","Condition","ICD10CM","3-char billing code","2007-01-01","2099-12-31"
"O82",NA,NA,NA,35210363,"Encounter for cesarean delivery without indication","Observation","ICD10CM","3-char billing code","2007-01-01","2099-12-31"
"Z33",NA,NA,NA,1576058,"Pregnant state","Observation","ICD10CM","3-char nonbill code","2012-01-01","2099-12-31"
"Z33.1",NA,NA,NA,45600319,"Pregnant state, incidental","Observation","ICD10CM","4-char billing code","1970-01-01","2099-12-31"
"Z33.2",NA,NA,NA,45547303,"Encounter for elective termination of pregnancy","Condition","ICD10CM","4-char billing code","1970-01-01","2099-12-31"
"Z33.3",NA,NA,NA,37202293,"Pregnant state, gestational carrier","Condition","ICD10CM","4-char billing code","2017-01-01","2099-12-31"
"Z34",NA,NA,NA,1576059,"Encounter for supervision of normal pregnancy","Observation","ICD10CM","3-char nonbill code","2012-01-01","2099-12-31"
"Z34.0",NA,NA,NA,1576060,"Encounter for supervision of normal first pregnancy","Observation","ICD10CM","4-char nonbill code","2012-01-01","2099-12-31"
"Z34.00",NA,NA,NA,45571343,"Encounter for supervision of normal first pregnancy, unspecified trimester","Observation","ICD10CM","5-char billing code","1970-01-01","2099-12-31"
"Z34.01",NA,NA,NA,45609924,"Encounter for supervision of normal first pregnancy, first trimester","Observation","ICD10CM","5-char billing code","1970-01-01","2099-12-31"
"Z34.02",NA,NA,NA,45609925,"Encounter for supervision of normal first pregnancy, second trimester","Observation","ICD10CM","5-char billing code","1970-01-01","2099-12-31"
"Z34.03",NA,NA,NA,45600320,"Encounter for supervision of normal first pregnancy, third trimester","Observation","ICD10CM","5-char billing code","1970-01-01","2099-12-31"
"Z34.8",NA,NA,NA,1576061,"Encounter for supervision of other normal pregnancy","Observation","ICD10CM","4-char nonbill code","2012-01-01","2099-12-31"
"Z34.80",NA,NA,NA,45605119,"Encounter for supervision of other normal pregnancy, unspecified trimester","Observation","ICD10CM","5-char billing code","1970-01-01","2099-12-31"
"Z34.81",NA,NA,NA,45600321,"Encounter for supervision of other normal pregnancy, first trimester","Observation","ICD10CM","5-char billing code","1970-01-01","2099-12-31"
"Z34.82",NA,NA,NA,45581022,"Encounter for supervision of other normal pregnancy, second trimester","Observation","ICD10CM","5-char billing code","1970-01-01","2099-12-31"
"Z34.83",NA,NA,NA,45542420,"Encounter for supervision of other normal pregnancy, third trimester","Observation","ICD10CM","5-char billing code","1970-01-01","2099-12-31"
"Z34.9",NA,NA,NA,1576062,"Encounter for supervision of normal pregnancy, unspecified","Observation","ICD10CM","4-char nonbill code","2012-01-01","2099-12-31"
"Z34.90",NA,NA,NA,45605120,"Encounter for supervision of normal pregnancy, unspecified, unspecified trimester","Observation","ICD10CM","5-char billing code","1970-01-01","2099-12-31"
"Z34.91",NA,NA,NA,45561624,"Encounter for supervision of normal pregnancy, unspecified, first trimester","Observation","ICD10CM","5-char billing code","1970-01-01","2099-12-31"
"Z34.92",NA,NA,NA,45556825,"Encounter for supervision of normal pregnancy, unspecified, second trimester","Observation","ICD10CM","5-char billing code","1970-01-01","2099-12-31"
"Z34.93",NA,NA,NA,45547304,"Encounter for supervision of normal pregnancy, unspecified, third trimester","Observation","ICD10CM","5-char billing code","1970-01-01","2099-12-31"
