"DX_CODE_2","CODE","LONG_DESCRIPTION","SHORT_DESCRIPTION","CONCEPT_ID","CONCEPT_NAME","DOMAIN_ID","VOCABULARY_ID","CONCEPT_CLASS_ID","START_DATE","END_DATE"
"209.12","20912","Malignant carcinoid tumor of the cecum","Malig carcinoid cecum",44821764,"Malignant carcinoid tumor of the cecum","Condition","ICD9CM","5-dig billing code","1970-01-01","2099-12-31"
"209.13","20913","Malignant carcinoid tumor of the ascending colon","Mal crcnoid ascend colon",44835719,"Malignant carcinoid tumor of the ascending colon","Condition","ICD9CM","5-dig billing code","1970-01-01","2099-12-31"
"209.14","20914","Malignant carcinoid tumor of the transverse colon","Mal crcnoid transv colon",44826437,"Malignant carcinoid tumor of the transverse colon","Condition","ICD9CM","5-dig billing code","1970-01-01","2099-12-31"
"209.15","20915","Malignant carcinoid tumor of the descending colon","Mal carcinoid desc colon",44826438,"Malignant carcinoid tumor of the descending colon","Condition","ICD9CM","5-dig billing code","1970-01-01","2099-12-31"
"209.16","20916","Malignant carcinoid tumor of the sigmoid colon","Mal carcinoid sig colon",44835720,"Malignant carcinoid tumor of the sigmoid colon","Condition","ICD9CM","5-dig billing code","1970-01-01","2099-12-31"
"209.17","20917","Malignant carcinoid tumor of the rectum","Malig carcinoid rectum",44832166,"Malignant carcinoid tumor of the rectum","Condition","ICD9CM","5-dig billing code","1970-01-01","2099-12-31"
"209.2",NA,NA,NA,44836880,"Malignant carcinoid tumors of other and unspecified sites","Condition","ICD9CM","4-dig nonbill code","1970-01-01","2099-12-31"
"209.20","20920","Malignant carcinoid tumor of unknown primary site","Mal crcnd prim site unkn",44827590,"Malignant carcinoid tumor of unknown primary site","Condition","ICD9CM","5-dig billing code","1970-01-01","2099-12-31"
"209.21","20921","Malignant carcinoid tumor of the bronchus and lung","Mal carcinoid bronc/lung",44822914,"Malignant carcinoid tumor of the bronchus and lung","Condition","ICD9CM","5-dig billing code","1970-01-01","2099-12-31"
"209.22","20922","Malignant carcinoid tumor of the thymus","Malig carcinoid thymus",44829853,"Malignant carcinoid tumor of the thymus","Condition","ICD9CM","5-dig billing code","1970-01-01","2099-12-31"
"209.23","20923","Malignant carcinoid tumor of the stomach","Malig carcinoid stomach",44825237,"Malignant carcinoid tumor of the stomach","Condition","ICD9CM","5-dig billing code","1970-01-01","2099-12-31"
"209.24","20924","Malignant carcinoid tumor of the kidney","Malig carcinoid kidney",44820648,"Malignant carcinoid tumor of the kidney","Condition","ICD9CM","5-dig billing code","1970-01-01","2099-12-31"
"209.25","20925","Malignant carcinoid tumor of foregut, not otherwise specified","Mal carcnoid foregut NOS",44828762,"Malignant carcinoid tumor of foregut, not otherwise specified","Condition","ICD9CM","5-dig billing code","1970-01-01","2099-12-31"
"209.26","20926","Malignant carcinoid tumor of midgut, not otherwise specified","Mal carcinoid midgut NOS",44829854,"Malignant carcinoid tumor of midgut, not otherwise specified","Condition","ICD9CM","5-dig billing code","1970-01-01","2099-12-31"
"209.27","20927","Malignant carcinoid tumor of hindgut, not otherwise specified","Mal carcnoid hindgut NOS",44835721,"Malignant carcinoid tumor of hindgut, not otherwise specified","Condition","ICD9CM","5-dig billing code","1970-01-01","2099-12-31"
"209.29","20929","Malignant carcinoid tumor of other sites","Malig carcinoid oth site",44821765,"Malignant carcinoid tumor of other sites","Condition","ICD9CM","5-dig billing code","1970-01-01","2099-12-31"
"209.3",NA,NA,NA,44824056,"Malignant poorly differentiated neuroendocrine tumors","Condition","ICD9CM","4-dig nonbill code","1970-01-01","2099-12-31"
"209.30","20930","Malignant poorly differentiated neuroendocrine carcinoma, any site","Malig neuroendo ca NOS",44819474,"Malignant poorly differentiated neuroendocrine carcinoma, any site","Condition","ICD9CM","5-dig billing code","1970-01-01","2099-12-31"
"209.31","20931","Merkel cell carcinoma of the face","Merkel cell ca-face",44832167,"Merkel cell carcinoma of the face","Condition","ICD9CM","5-dig billing code","2013-10-10","2099-12-31"
"209.32","20932","Merkel cell carcinoma of the scalp and neck","Merkel cell ca-sclp/neck",44828763,"Merkel cell carcinoma of the scalp and neck","Condition","ICD9CM","5-dig billing code","2013-10-10","2099-12-31"
"209.33","20933","Merkel cell carcinoma of the upper limb","Merkel cell ca-up limb",44832168,"Merkel cell carcinoma of the upper limb","Condition","ICD9CM","5-dig billing code","2013-10-10","2099-12-31"
"209.34","20934","Merkel cell carcinoma of the lower limb","Merkel cell ca-low limb",44827591,"Merkel cell carcinoma of the lower limb","Condition","ICD9CM","5-dig billing code","2013-10-10","2099-12-31"
"209.35","20935","Merkel cell carcinoma of the trunk","Merkel cell ca-trunk",44820649,"Merkel cell carcinoma of the trunk","Condition","ICD9CM","5-dig billing code","2013-10-10","2099-12-31"
"209.36","20936","Merkel cell carcinoma of other sites","Merkel cell ca-oth sites",44824057,"Merkel cell carcinoma of other sites","Condition","ICD9CM","5-dig billing code","2013-10-10","2099-12-31"
"209.4",NA,NA,NA,44821766,"Benign carcinoid tumors of the small intestine","Condition","ICD9CM","4-dig nonbill code","1970-01-01","2099-12-31"
"209.40","20940","Benign carcinoid tumor of the small intestine, unspecified portion","Ben crcnoid sm intst NOS",44825238,"Benign carcinoid tumor of the small intestine, unspecified portion","Condition","ICD9CM","5-dig billing code","1970-01-01","2099-12-31"
"209.41","20941","Benign carcinoid tumor of the duodenum","Ben carcinoid duodenum",44827592,"Benign carcinoid tumor of the duodenum","Condition","ICD9CM","5-dig billing code","1970-01-01","2099-12-31"
"209.42","20942","Benign carcinoid tumor of the jejunum","Benign carcinoid jejunum",44834523,"Benign carcinoid tumor of the jejunum","Condition","ICD9CM","5-dig billing code","1970-01-01","2099-12-31"
"209.43","20943","Benign carcinoid tumor of the ileum","Benign carcinoid ileum",44824058,"Benign carcinoid tumor of the ileum","Condition","ICD9CM","5-dig billing code","1970-01-01","2099-12-31"
"209.5",NA,NA,NA,44826439,"Benign carcinoid tumors of the appendix, large intestine, and rectum","Condition","ICD9CM","4-dig nonbill code","1970-01-01","2099-12-31"
"209.50","20950","Benign carcinoid tumor of the large intestine, unspecified portion","Ben crcnoid lg intst NOS",44836881,"Benign carcinoid tumor of the large intestine, unspecified portion","Condition","ICD9CM","5-dig billing code","1970-01-01","2099-12-31"
"209.51","20951","Benign carcinoid tumor of the appendix","Ben carcinoid appendix",44832169,"Benign carcinoid tumor of the appendix","Condition","ICD9CM","5-dig billing code","1970-01-01","2099-12-31"
"209.52","20952","Benign carcinoid tumor of the cecum","Benign carcinoid cecum",44836882,"Benign carcinoid tumor of the cecum","Condition","ICD9CM","5-dig billing code","1970-01-01","2099-12-31"
"209.53","20953","Benign carcinoid tumor of the ascending colon","Ben carcinoid asc colon",44821767,"Benign carcinoid tumor of the ascending colon","Condition","ICD9CM","5-dig billing code","1970-01-01","2099-12-31"
"209.54","20954","Benign carcinoid tumor of the transverse colon","Ben crcinoid trans colon",44825239,"Benign carcinoid tumor of the transverse colon","Condition","ICD9CM","5-dig billing code","1970-01-01","2099-12-31"
"209.55","20955","Benign carcinoid tumor of the descending colon","Ben carcinoid desc colon",44820650,"Benign carcinoid tumor of the descending colon","Condition","ICD9CM","5-dig billing code","1970-01-01","2099-12-31"
"209.56","20956","Benign carcinoid tumor of the sigmoid colon","Ben carcinoid sig colon",44831023,"Benign carcinoid tumor of the sigmoid colon","Condition","ICD9CM","5-dig billing code","1970-01-01","2099-12-31"
"209.57","20957","Benign carcinoid tumor of the rectum","Benign carcinoid rectum",44824059,"Benign carcinoid tumor of the rectum","Condition","ICD9CM","5-dig billing code","1970-01-01","2099-12-31"
"209.6",NA,NA,NA,44836883,"Benign carcinoid tumors of other and unspecified sites","Condition","ICD9CM","4-dig nonbill code","1970-01-01","2099-12-31"
"209.60","20960","Benign carcinoid tumor of unknown primary site","Ben crcnd prim site unkn",44819475,"Benign carcinoid tumor of unknown primary site","Condition","ICD9CM","5-dig billing code","1970-01-01","2099-12-31"
"209.61","20961","Benign carcinoid tumor of the bronchus and lung","Ben carcinoid bronc/lung",44836884,"Benign carcinoid tumor of the bronchus and lung","Condition","ICD9CM","5-dig billing code","1970-01-01","2099-12-31"
"209.62","20962","Benign carcinoid tumor of the thymus","Benign carcinoid thymus",44825240,"Benign carcinoid tumor of the thymus","Condition","ICD9CM","5-dig billing code","1970-01-01","2099-12-31"
"209.63","20963","Benign carcinoid tumor of the stomach","Benign carcinoid stomach",44827593,"Benign carcinoid tumor of the stomach","Condition","ICD9CM","5-dig billing code","1970-01-01","2099-12-31"
"209.64","20964","Benign carcinoid tumor of the kidney","Benign carcinoid kidney",44829855,"Benign carcinoid tumor of the kidney","Condition","ICD9CM","5-dig billing code","1970-01-01","2099-12-31"
"209.65","20965","Benign carcinoid tumor of foregut, not otherwise specified","Ben crcinoid foregut NOS",44834524,"Benign carcinoid tumor of foregut, not otherwise specified","Condition","ICD9CM","5-dig billing code","1970-01-01","2099-12-31"
"209.66","20966","Benign carcinoid tumor of midgut, not otherwise specified","Ben crcinoid midgut NOS",44832170,"Benign carcinoid tumor of midgut, not otherwise specified","Condition","ICD9CM","5-dig billing code","1970-01-01","2099-12-31"
"209.67","20967","Benign carcinoid tumor of hindgut, not otherwise specified","Ben crcnoid hindgut NOS",44833346,"Benign carcinoid tumor of hindgut, not otherwise specified","Condition","ICD9CM","5-dig billing code","1970-01-01","2099-12-31"
"209.69","20969","Benign carcinoid tumor of other sites","Bengn carcinoid oth site",44819476,"Benign carcinoid tumor of other sites","Condition","ICD9CM","5-dig billing code","1970-01-01","2099-12-31"
"209.7",NA,NA,NA,45890917,"Secondary neuroendocrine tumors","Condition","ICD9CM","4-dig nonbill code","2014-10-01","2099-12-31"
"209.70","20970","Secondary neuroendocrine tumor, unspecified site","Sec neuroendo tumor NOS",44827594,"Secondary neuroendocrine tumor, unspecified site","Condition","ICD9CM","5-dig billing code","2013-10-10","2099-12-31"
"209.71","20971","Secondary neuroendocrine tumor of distant lymph nodes","Sec neuroend tu dist lym",44831024,"Secondary neuroendocrine tumor of distant lymph nodes","Condition","ICD9CM","5-dig billing code","2013-10-10","2099-12-31"
"209.72","20972","Secondary neuroendocrine tumor of liver","Sec neuroend tumor-liver",44836885,"Secondary neuroendocrine tumor of liver","Measurement","ICD9CM","5-dig billing code","2013-10-10","2099-12-31"
"209.73","20973","Secondary neuroendocrine tumor of bone","Sec neuroendo tumor-bone",44832171,"Secondary neuroendocrine tumor of bone","Measurement","ICD9CM","5-dig billing code","2013-10-10","2099-12-31"
"209.74","20974","Secondary neuroendocrine tumor of peritoneum","Sec neuroendo tu-periton",44827595,"Secondary neuroendocrine tumor of peritoneum","Measurement","ICD9CM","5-dig billing code","2013-10-10","2099-12-31"
"209.75","20975","Secondary Merkel cell carcinoma","Secondary Merkel cell ca",44828764,"Secondary Merkel cell carcinoma","Condition","ICD9CM","5-dig billing code","2013-10-10","2099-12-31"
"209.79","20979","Secondary neuroendocrine tumor of other sites","Sec neuroend tu oth site",44828765,"Secondary neuroendocrine tumor of other sites","Condition","ICD9CM","5-dig billing code","2013-10-10","2099-12-31"
"210",NA,NA,NA,44834525,"Benign neoplasm of lip, oral cavity, and pharynx","Condition","ICD9CM","3-dig nonbill code","1970-01-01","2099-12-31"
"210.0","2100","Benign neoplasm of lip","Benign neoplasm lip",44831025,"Benign neoplasm of lip","Condition","ICD9CM","4-dig billing code","1970-01-01","2099-12-31"
"210.1","2101","Benign neoplasm of tongue","Benign neoplasm tongue",44819477,"Benign neoplasm of tongue","Condition","ICD9CM","4-dig billing code","1970-01-01","2099-12-31"
"210.2","2102","Benign neoplasm of major salivary glands","Ben neo major salivary",44820651,"Benign neoplasm of major salivary glands","Condition","ICD9CM","4-dig billing code","1970-01-01","2099-12-31"
"210.3","2103","Benign neoplasm of floor of mouth","Benign neo mouth floor",44819478,"Benign neoplasm of floor of mouth","Condition","ICD9CM","4-dig billing code","1970-01-01","2099-12-31"
"210.4","2104","Benign neoplasm of other and unspecified parts of mouth","Benign neo mouth NEC/NOS",44835722,"Benign neoplasm of other and unspecified parts of mouth","Condition","ICD9CM","4-dig billing code","1970-01-01","2099-12-31"
"210.5","2105","Benign neoplasm of tonsil","Benign neoplasm tonsil",44833347,"Benign neoplasm of tonsil","Condition","ICD9CM","4-dig billing code","1970-01-01","2099-12-31"
"210.6","2106","Benign neoplasm of other parts of oropharynx","Benign neo oropharyn NEC",44824060,"Benign neoplasm of other parts of oropharynx","Condition","ICD9CM","4-dig billing code","1970-01-01","2099-12-31"
"210.7","2107","Benign neoplasm of nasopharynx","Benign neo nasopharynx",44820652,"Benign neoplasm of nasopharynx","Condition","ICD9CM","4-dig billing code","1970-01-01","2099-12-31"
"210.8","2108","Benign neoplasm of hypopharynx","Benign neo hypopharynx",44835723,"Benign neoplasm of hypopharynx","Condition","ICD9CM","4-dig billing code","1970-01-01","2099-12-31"
"210.9","2109","Benign neoplasm of pharynx, unspecified","Benign neo pharynx NOS",44833348,"Benign neoplasm of pharynx, unspecified","Condition","ICD9CM","4-dig billing code","1970-01-01","2099-12-31"
"211",NA,NA,NA,44832172,"Benign neoplasm of other parts of digestive system","Condition","ICD9CM","3-dig nonbill code","1970-01-01","2099-12-31"
"211.0","2110","Benign neoplasm of esophagus","Benign neo esophagus",44827596,"Benign neoplasm of esophagus","Condition","ICD9CM","4-dig billing code","1970-01-01","2099-12-31"
"211.1","2111","Benign neoplasm of stomach","Benign neoplasm stomach",44835724,"Benign neoplasm of stomach","Condition","ICD9CM","4-dig billing code","1970-01-01","2099-12-31"
"211.2","2112","Benign neoplasm of duodenum, jejunum, and ileum","Benign neoplasm sm bowel",44822915,"Benign neoplasm of duodenum, jejunum, and ileum","Condition","ICD9CM","4-dig billing code","1970-01-01","2099-12-31"
"211.3","2113","Benign neoplasm of colon","Benign neoplasm lg bowel",44825241,"Benign neoplasm of colon","Condition","ICD9CM","4-dig billing code","1970-01-01","2099-12-31"
"211.4","2114","Benign neoplasm of rectum and anal canal","Benign neopl rectum/anus",44836886,"Benign neoplasm of rectum and anal canal","Condition","ICD9CM","4-dig billing code","1970-01-01","2099-12-31"
"211.5","2115","Benign neoplasm of liver and biliary passages","Ben neo liver/bile ducts",44820653,"Benign neoplasm of liver and biliary passages","Condition","ICD9CM","4-dig billing code","1970-01-01","2099-12-31"
"211.6","2116","Benign neoplasm of pancreas, except islets of Langerhans","Benign neoplasm pancreas",44821768,"Benign neoplasm of pancreas, except islets of Langerhans","Condition","ICD9CM","4-dig billing code","1970-01-01","2099-12-31"
"211.7","2117","Benign neoplasm of islets of Langerhans","Ben neo islets langerhan",44820654,"Benign neoplasm of islets of Langerhans","Condition","ICD9CM","4-dig billing code","1970-01-01","2099-12-31"
"211.8","2118","Benign neoplasm of retroperitoneum and peritoneum","Ben neo peritoneum",44831026,"Benign neoplasm of retroperitoneum and peritoneum","Condition","ICD9CM","4-dig billing code","1970-01-01","2099-12-31"
"211.9","2119","Benign neoplasm of other and unspecified site in the digestive system","Ben neo GI tract NEC/NOS",44822916,"Benign neoplasm of other and unspecified site in the digestive system","Condition","ICD9CM","4-dig billing code","1970-01-01","2099-12-31"
"212",NA,NA,NA,44828766,"Benign neoplasm of respiratory and intrathoracic organs","Condition","ICD9CM","3-dig nonbill code","1970-01-01","2099-12-31"
"212.0","2120","Benign neoplasm of nasal cavities, middle ear, and accessory sinuses","Ben neo nasal cav/sinus",44829856,"Benign neoplasm of nasal cavities, middle ear, and accessory sinuses","Condition","ICD9CM","4-dig billing code","1970-01-01","2099-12-31"
"212.1","2121","Benign neoplasm of larynx","Benign neo larynx",44827597,"Benign neoplasm of larynx","Condition","ICD9CM","4-dig billing code","1970-01-01","2099-12-31"
"212.2","2122","Benign neoplasm of trachea","Benign neo trachea",44835725,"Benign neoplasm of trachea","Condition","ICD9CM","4-dig billing code","1970-01-01","2099-12-31"
"212.3","2123","Benign neoplasm of bronchus and lung","Benign neo bronchus/lung",44826440,"Benign neoplasm of bronchus and lung","Condition","ICD9CM","4-dig billing code","1970-01-01","2099-12-31"
"212.4","2124","Benign neoplasm of pleura","Benign neoplasm pleura",44829857,"Benign neoplasm of pleura","Condition","ICD9CM","4-dig billing code","1970-01-01","2099-12-31"
"212.5","2125","Benign neoplasm of mediastinum","Benign neo mediastinum",44825242,"Benign neoplasm of mediastinum","Condition","ICD9CM","4-dig billing code","1970-01-01","2099-12-31"
"212.6","2126","Benign neoplasm of thymus","Benign neoplasm thymus",44836887,"Benign neoplasm of thymus","Condition","ICD9CM","4-dig billing code","1970-01-01","2099-12-31"
"212.7","2127","Benign neoplasm of heart","Benign neoplasm heart",44822917,"Benign neoplasm of heart","Condition","ICD9CM","4-dig billing code","1970-01-01","2099-12-31"
"212.8","2128","Benign neoplasm of other specified sites of respiratory and intrathoracic organs","Benign neo resp sys NEC",44824061,"Benign neoplasm of other specified sites of respiratory and intrathoracic organs","Condition","ICD9CM","4-dig billing code","1970-01-01","2099-12-31"
"212.9","2129","Benign neoplasm of respiratory and intrathoracic organs, site unspecified","Benign neo resp sys NOS",44832173,"Benign neoplasm of respiratory and intrathoracic organs, site unspecified","Condition","ICD9CM","4-dig billing code","1970-01-01","2099-12-31"
"213",NA,NA,NA,44828767,"Benign neoplasm of bone and articular cartilage","Condition","ICD9CM","3-dig nonbill code","1970-01-01","2099-12-31"
"213.0","2130","Benign neoplasm of bones of skull and face","Ben neo skull/face bone",44834526,"Benign neoplasm of bones of skull and face","Condition","ICD9CM","4-dig billing code","1970-01-01","2099-12-31"
"213.1","2131","Benign neoplasm of lower jaw bone","Ben neo lower jaw bone",44833349,"Benign neoplasm of lower jaw bone","Condition","ICD9CM","4-dig billing code","1970-01-01","2099-12-31"
"213.2","2132","Benign neoplasm of vertebral column, excluding sacrum and coccyx","Benign neo vertebrae",44835726,"Benign neoplasm of vertebral column, excluding sacrum and coccyx","Condition","ICD9CM","4-dig billing code","1970-01-01","2099-12-31"
"213.3","2133","Benign neoplasm of ribs, sternum, and clavicle","Ben neo ribs/stern/clav",44827598,"Benign neoplasm of ribs, sternum, and clavicle","Condition","ICD9CM","4-dig billing code","1970-01-01","2099-12-31"
"213.4","2134","Benign neoplasm of scapula and long bones of upper limb","Ben neo long bones arm",44831027,"Benign neoplasm of scapula and long bones of upper limb","Condition","ICD9CM","4-dig billing code","1970-01-01","2099-12-31"
"213.5","2135","Benign neoplasm of short bones of upper limb","Ben neo bones wrist/hand",44825243,"Benign neoplasm of short bones of upper limb","Condition","ICD9CM","4-dig billing code","1970-01-01","2099-12-31"
"213.6","2136","Benign neoplasm of pelvic bones, sacrum, and coccyx","Benign neo pelvic girdle",44826441,"Benign neoplasm of pelvic bones, sacrum, and coccyx","Condition","ICD9CM","4-dig billing code","1970-01-01","2099-12-31"
"213.7","2137","Benign neoplasm of long bones of lower limb","Ben neo long bones leg",44836888,"Benign neoplasm of long bones of lower limb","Condition","ICD9CM","4-dig billing code","1970-01-01","2099-12-31"
"213.8","2138","Benign neoplasm of short bones of lower limb","Ben neo bones ankle/foot",44835727,"Benign neoplasm of short bones of lower limb","Condition","ICD9CM","4-dig billing code","1970-01-01","2099-12-31"
"213.9","2139","Benign neoplasm of bone and articular cartilage, site unspecified","Benign neo bone NOS",44819479,"Benign neoplasm of bone and articular cartilage, site unspecified","Condition","ICD9CM","4-dig billing code","1970-01-01","2099-12-31"
"214",NA,NA,NA,44833350,"Lipoma","Condition","ICD9CM","3-dig nonbill code","1970-01-01","2099-12-31"
"214.0","2140","Lipoma of skin and subcutaneous tissue of face","Lipoma skin face",44835728,"Lipoma of skin and subcutaneous tissue of face","Condition","ICD9CM","4-dig billing code","1970-01-01","2099-12-31"
"214.1","2141","Lipoma of other skin and subcutaneous tissue","Lipoma skin NEC",44836889,"Lipoma of other skin and subcutaneous tissue","Condition","ICD9CM","4-dig billing code","1970-01-01","2099-12-31"
"214.2","2142","Lipoma of intrathoracic organs","Lipoma intrathoracic",44832174,"Lipoma of intrathoracic organs","Condition","ICD9CM","4-dig billing code","1970-01-01","2099-12-31"
"214.3","2143","Lipoma of intra-abdominal organs","Lipoma intra-abdominal",44835729,"Lipoma of intra-abdominal organs","Condition","ICD9CM","4-dig billing code","1970-01-01","2099-12-31"
"214.4","2144","Lipoma of spermatic cord","Lipoma spermatic cord",44829858,"Lipoma of spermatic cord","Condition","ICD9CM","4-dig billing code","1970-01-01","2099-12-31"
"214.8","2148","Lipoma of other specified sites","Lipoma NEC",44824062,"Lipoma of other specified sites","Condition","ICD9CM","4-dig billing code","1970-01-01","2099-12-31"
"214.9","2149","Lipoma, unspecified site","Lipoma NOS",44832175,"Lipoma, unspecified site","Condition","ICD9CM","4-dig billing code","1970-01-01","2099-12-31"
"215",NA,NA,NA,44833351,"Other benign neoplasm of connective and other soft tissue","Condition","ICD9CM","3-dig nonbill code","1970-01-01","2099-12-31"
"215.0","2150","Other benign neoplasm of connective and other soft tissue of head, face, and neck","Ben neo soft tissue head",44820655,"Other benign neoplasm of connective and other soft tissue of head, face, and neck","Condition","ICD9CM","4-dig billing code","1970-01-01","2099-12-31"
"215.2","2152","Other benign neoplasm of connective and other soft tissue of upper limb, including shoulder","Ben neo soft tissue arm",44831028,"Other benign neoplasm of connective and other soft tissue of upper limb, including shoulder","Condition","ICD9CM","4-dig billing code","1970-01-01","2099-12-31"
"215.3","2153","Other benign neoplasm of connective and other soft tissue of lower limb, including hip","Ben neo soft tissue leg",44821769,"Other benign neoplasm of connective and other soft tissue of lower limb, including hip","Condition","ICD9CM","4-dig billing code","1970-01-01","2099-12-31"
"215.4","2154","Other benign neoplasm of connective and other soft tissue of thorax","Ben neo soft tis thorax",44827599,"Other benign neoplasm of connective and other soft tissue of thorax","Condition","ICD9CM","4-dig billing code","1970-01-01","2099-12-31"
"215.5","2155","Other benign neoplasm of connective and other soft tissue of abdomen","Ben neo soft tis abdomen",44834527,"Other benign neoplasm of connective and other soft tissue of abdomen","Condition","ICD9CM","4-dig billing code","1970-01-01","2099-12-31"
"215.6","2156","Other benign neoplasm of connective and other soft tissue of pelvis","Ben neo soft tis pelvis",44825244,"Other benign neoplasm of connective and other soft tissue of pelvis","Condition","ICD9CM","4-dig billing code","1970-01-01","2099-12-31"
"215.7","2157","Other benign neoplasm of connective and other soft tissue of trunk, unspecified","Benign neo trunk NOS",44820656,"Other benign neoplasm of connective and other soft tissue of trunk, unspecified","Condition","ICD9CM","4-dig billing code","1970-01-01","2099-12-31"
"215.8","2158","Other benign neoplasm of connective and other soft tissue of other specified sites","Ben neo soft tissue NEC",44826442,"Other benign neoplasm of connective and other soft tissue of other specified sites","Condition","ICD9CM","4-dig billing code","1970-01-01","2099-12-31"
"215.9","2159","Other benign neoplasm of connective and other soft tissue, site unspecified","Ben neo soft tissue NOS",44820657,"Other benign neoplasm of connective and other soft tissue, site unspecified","Condition","ICD9CM","4-dig billing code","1970-01-01","2099-12-31"
"216",NA,NA,NA,44829859,"Benign neoplasm of skin","Condition","ICD9CM","3-dig nonbill code","1970-01-01","2099-12-31"
"216.0","2160","Benign neoplasm of skin of lip","Benign neo skin lip",44819480,"Benign neoplasm of skin of lip","Condition","ICD9CM","4-dig billing code","1970-01-01","2099-12-31"
"216.1","2161","Benign neoplasm of eyelid, including canthus","Benign neo skin eyelid",44826443,"Benign neoplasm of eyelid, including canthus","Condition","ICD9CM","4-dig billing code","1970-01-01","2099-12-31"
"216.2","2162","Benign neoplasm of ear and external auditory canal","Benign neo skin ear",44835730,"Benign neoplasm of ear and external auditory canal","Condition","ICD9CM","4-dig billing code","1970-01-01","2099-12-31"
"216.3","2163","Benign neoplasm of skin of other and unspecified parts of face","Benign neo skin face NEC",44832176,"Benign neoplasm of skin of other and unspecified parts of face","Condition","ICD9CM","4-dig billing code","1970-01-01","2099-12-31"
"216.4","2164","Benign neoplasm of scalp and skin of neck","Ben neo scalp/skin neck",44833352,"Benign neoplasm of scalp and skin of neck","Condition","ICD9CM","4-dig billing code","1970-01-01","2099-12-31"
