"DX_CODE_2","CODE","SHORT_DESCRIPTION","LONG_DESCRIPTION","CONCEPT_ID","CONCEPT_NAME","DOMAIN_ID","VOCABULARY_ID","CONCEPT_CLASS_ID","START_DATE","END_DATE"
"O00",NA,NA,NA,1571602,"Ectopic pregnancy","Condition","ICD10CM","3-char nonbill code","2012-01-01","2099-12-31"
"O00.0","O000","Abdominal pregnancy","Abdominal pregnancy",35209513,"Abdominal pregnancy","Condition","ICD10CM","4-char nonbill code","2007-01-01","2099-12-31"
"O00.00","O0000","Abdominal pregnancy without intrauterine pregnancy","Abdominal pregnancy without intrauterine pregnancy",37200942,"Abdominal pregnancy without intrauterine pregnancy","Condition","ICD10CM","5-char billing code","2017-01-01","2099-12-31"
"O00.01","O0001","Abdominal pregnancy with intrauterine pregnancy","Abdominal pregnancy with intrauterine pregnancy",37200943,"Abdominal pregnancy with intrauterine pregnancy","Condition","ICD10CM","5-char billing code","2017-01-01","2099-12-31"
"O00.1","O001","Tubal pregnancy","Tubal pregnancy",35209514,"Tubal pregnancy","Condition","ICD10CM","4-char nonbill code","2007-01-01","2099-12-31"
"O00.10","O0010","Tubal pregnancy without intrauterine pregnancy","Tubal pregnancy without intrauterine pregnancy",37200944,"Tubal pregnancy without intrauterine pregnancy","Condition","ICD10CM","5-char nonbill code","2017-01-01","2099-12-31"
"O00.101","O00101","Right tubal pregnancy without intrauterine pregnancy","Right tubal pregnancy without intrauterine pregnancy",1326728,"Right tubal pregnancy without intrauterine pregnancy","Condition","ICD10CM","6-char billing code","2018-01-01","2099-12-31"
"O00.102","O00102","Left tubal pregnancy without intrauterine pregnancy","Left tubal pregnancy without intrauterine pregnancy",1326729,"Left tubal pregnancy without intrauterine pregnancy","Condition","ICD10CM","6-char billing code","2018-01-01","2099-12-31"
"O00.109","O00109","Unspecified tubal pregnancy without intrauterine pregnancy","Unspecified tubal pregnancy without intrauterine pregnancy",1326730,"Unspecified tubal pregnancy without intrauterine pregnancy","Condition","ICD10CM","6-char billing code","2018-01-01","2099-12-31"
"O00.11","O0011","Tubal pregnancy with intrauterine pregnancy","Tubal pregnancy with intrauterine pregnancy",37200945,"Tubal pregnancy with intrauterine pregnancy","Condition","ICD10CM","5-char nonbill code","2017-01-01","2099-12-31"
"O00.111","O00111","Right tubal pregnancy with intrauterine pregnancy","Right tubal pregnancy with intrauterine pregnancy",1326731,"Right tubal pregnancy with intrauterine pregnancy","Condition","ICD10CM","6-char billing code","2018-01-01","2099-12-31"
"O00.112","O00112","Left tubal pregnancy with intrauterine pregnancy","Left tubal pregnancy with intrauterine pregnancy",1326732,"Left tubal pregnancy with intrauterine pregnancy","Condition","ICD10CM","6-char billing code","2018-01-01","2099-12-31"
"O00.119","O00119","Unspecified tubal pregnancy with intrauterine pregnancy","Unspecified tubal pregnancy with intrauterine pregnancy",1326733,"Unspecified tubal pregnancy with intrauterine pregnancy","Condition","ICD10CM","6-char billing code","2018-01-01","2099-12-31"
"O00.2","O002","Ovarian pregnancy","Ovarian pregnancy",35209515,"Ovarian pregnancy","Condition","ICD10CM","4-char nonbill code","2007-01-01","2099-12-31"
"O00.20","O0020","Ovarian pregnancy without intrauterine pregnancy","Ovarian pregnancy without intrauterine pregnancy",37200946,"Ovarian pregnancy without intrauterine pregnancy","Condition","ICD10CM","5-char nonbill code","2017-01-01","2099-12-31"
"O00.201","O00201","Right ovarian pregnancy without intrauterine pregnancy","Right ovarian pregnancy without intrauterine pregnancy",1326734,"Right ovarian pregnancy without intrauterine pregnancy","Condition","ICD10CM","6-char billing code","2018-01-01","2099-12-31"
"O00.202","O00202","Left ovarian pregnancy without intrauterine pregnancy","Left ovarian pregnancy without intrauterine pregnancy",1326735,"Left ovarian pregnancy without intrauterine pregnancy","Condition","ICD10CM","6-char billing code","2018-01-01","2099-12-31"
"O00.209","O00209","Unspecified ovarian pregnancy without intrauterine pregnancy","Unspecified ovarian pregnancy without intrauterine pregnancy",1326736,"Unspecified ovarian pregnancy without intrauterine pregnancy","Condition","ICD10CM","6-char billing code","2018-01-01","2099-12-31"
"O00.21","O0021","Ovarian pregnancy with intrauterine pregnancy","Ovarian pregnancy with intrauterine pregnancy",37200947,"Ovarian pregnancy with intrauterine pregnancy","Condition","ICD10CM","5-char nonbill code","2017-01-01","2099-12-31"
"O00.211","O00211","Right ovarian pregnancy with intrauterine pregnancy","Right ovarian pregnancy with intrauterine pregnancy",1326737,"Right ovarian pregnancy with intrauterine pregnancy","Condition","ICD10CM","6-char billing code","2018-01-01","2099-12-31"
"O00.212","O00212","Left ovarian pregnancy with intrauterine pregnancy","Left ovarian pregnancy with intrauterine pregnancy",1326738,"Left ovarian pregnancy with intrauterine pregnancy","Condition","ICD10CM","6-char billing code","2018-01-01","2099-12-31"
"O00.219","O00219","Unspecified ovarian pregnancy with intrauterine pregnancy","Unspecified ovarian pregnancy with intrauterine pregnancy",1326739,"Unspecified ovarian pregnancy with intrauterine pregnancy","Condition","ICD10CM","6-char billing code","2018-01-01","2099-12-31"
"O00.8","O008","Other ectopic pregnancy","Other ectopic pregnancy",35209516,"Other ectopic pregnancy","Condition","ICD10CM","4-char nonbill code","2007-01-01","2099-12-31"
"O00.80","O0080","Other ectopic pregnancy without intrauterine pregnancy","Other ectopic pregnancy without intrauterine pregnancy",37200948,"Other ectopic pregnancy without intrauterine pregnancy","Condition","ICD10CM","5-char billing code","2017-01-01","2099-12-31"
"O00.81","O0081","Other ectopic pregnancy with intrauterine pregnancy","Other ectopic pregnancy with intrauterine pregnancy",37200949,"Other ectopic pregnancy with intrauterine pregnancy","Condition","ICD10CM","5-char billing code","2017-01-01","2099-12-31"
"O00.9","O009","Ectopic pregnancy, unspecified","Ectopic pregnancy, unspecified",35209517,"Ectopic pregnancy, unspecified","Condition","ICD10CM","4-char nonbill code","2007-01-01","2099-12-31"
"O00.90","O0090","Unspecified ectopic pregnancy without intrauterine pregnancy","Unspecified ectopic pregnancy without intrauterine pregnancy",37200950,"Unspecified ectopic pregnancy without intrauterine pregnancy","Condition","ICD10CM","5-char billing code","2017-01-01","2099-12-31"
"O00.91","O0091","Unspecified ectopic pregnancy with intrauterine pregnancy","Unspecified ectopic pregnancy with intrauterine pregnancy",37200951,"Unspecified ectopic pregnancy with intrauterine pregnancy","Condition","ICD10CM","5-char billing code","2017-01-01","2099-12-31"
"O01",NA,NA,NA,1571603,"Hydatidiform mole","Condition","ICD10CM","3-char nonbill code","2012-01-01","2099-12-31"
"O01.0","O010","Classical hydatidiform mole","Classical hydatidiform mole",35209518,"Classical hydatidiform mole","Condition","ICD10CM","4-char billing code","2007-01-01","2099-12-31"
"O01.1","O011","Incomplete and partial hydatidiform mole","Incomplete and partial hydatidiform mole",35209519,"Incomplete and partial hydatidiform mole","Condition","ICD10CM","4-char billing code","2007-01-01","2099-12-31"
"O01.9","O019","Hydatidiform mole, unspecified","Hydatidiform mole, unspecified",35209520,"Hydatidiform mole, unspecified","Condition","ICD10CM","4-char billing code","2007-01-01","2099-12-31"
"O02",NA,NA,NA,1571604,"Other abnormal products of conception","Condition","ICD10CM","3-char nonbill code","2012-01-01","2099-12-31"
"O02.0","O020","Blighted ovum and nonhydatidiform mole","Blighted ovum and nonhydatidiform mole",35209521,"Blighted ovum and nonhydatidiform mole","Condition","ICD10CM","4-char billing code","2007-01-01","2099-12-31"
"O02.1","O021","Missed abortion","Missed abortion",35209522,"Missed abortion","Condition","ICD10CM","4-char billing code","2007-01-01","2099-12-31"
"O02.8",NA,NA,NA,35209523,"Other specified abnormal products of conception","Condition","ICD10CM","4-char nonbill code","2007-01-01","2099-12-31"
"O02.81","O0281","Inapprop chg quantitav hCG in early pregnancy","Inappropriate change in quantitative human chorionic gonadotropin (hCG) in early pregnancy",45582435,"Inappropriate change in quantitative human chorionic gonadotropin (hCG) in early pregnancy","Measurement","ICD10CM","5-char billing code","2006-12-30","2099-12-31"
"O02.89","O0289","Other abnormal products of conception","Other abnormal products of conception",45592169,"Other abnormal products of conception","Condition","ICD10CM","5-char billing code","2006-12-30","2099-12-31"
"O02.9","O029","Abnormal product of conception, unspecified","Abnormal product of conception, unspecified",35209524,"Abnormal product of conception, unspecified","Condition","ICD10CM","4-char billing code","2007-01-01","2099-12-31"
"O03",NA,NA,NA,1571605,"Spontaneous abortion","Condition","ICD10CM","3-char nonbill code","2012-01-01","2099-12-31"
"O03.0","O030","Genitl trct and pelvic infection fol incmpl spon abortion","Genital tract and pelvic infection following incomplete spontaneous abortion",35209525,"Genital tract and pelvic infection following incomplete spontaneous abortion","Condition","ICD10CM","4-char billing code","2007-01-01","2099-12-31"
"O03.1","O031","Delayed or excessive hemor following incmpl spon abortion","Delayed or excessive hemorrhage following incomplete spontaneous abortion",35209526,"Delayed or excessive hemorrhage following incomplete spontaneous abortion","Condition","ICD10CM","4-char billing code","2007-01-01","2099-12-31"
"O03.2","O032","Embolism following incomplete spontaneous abortion","Embolism following incomplete spontaneous abortion",35209527,"Embolism following incomplete spontaneous abortion","Condition","ICD10CM","4-char billing code","2007-01-01","2099-12-31"
"O03.3",NA,NA,NA,1571606,"Other and unspecified complications following incomplete spontaneous abortion","Condition","ICD10CM","4-char nonbill code","2012-01-01","2099-12-31"
"O03.30","O0330","Unsp complication following incomplete spontaneous abortion","Unspecified complication following incomplete spontaneous abortion",45596897,"Unspecified complication following incomplete spontaneous abortion","Condition","ICD10CM","5-char billing code","1970-01-01","2099-12-31"
"O03.31","O0331","Shock following incomplete spontaneous abortion","Shock following incomplete spontaneous abortion",45572746,"Shock following incomplete spontaneous abortion","Condition","ICD10CM","5-char billing code","1970-01-01","2099-12-31"
"O03.32","O0332","Renal failure following incomplete spontaneous abortion","Renal failure following incomplete spontaneous abortion",45558184,"Renal failure following incomplete spontaneous abortion","Condition","ICD10CM","5-char billing code","1970-01-01","2099-12-31"
"O03.33","O0333","Metabolic disorder following incomplete spontaneous abortion","Metabolic disorder following incomplete spontaneous abortion",45592171,"Metabolic disorder following incomplete spontaneous abortion","Condition","ICD10CM","5-char billing code","1970-01-01","2099-12-31"
"O03.34","O0334","Damage to pelvic organs following incomplete spon abortion","Damage to pelvic organs following incomplete spontaneous abortion",45596898,"Damage to pelvic organs following incomplete spontaneous abortion","Condition","ICD10CM","5-char billing code","1970-01-01","2099-12-31"
"O03.35","O0335","Oth venous comp following incomplete spontaneous abortion","Other venous complications following incomplete spontaneous abortion",45592172,"Other venous complications following incomplete spontaneous abortion","Condition","ICD10CM","5-char billing code","1970-01-01","2099-12-31"
"O03.36","O0336","Cardiac arrest following incomplete spontaneous abortion","Cardiac arrest following incomplete spontaneous abortion",45563037,"Cardiac arrest following incomplete spontaneous abortion","Condition","ICD10CM","5-char billing code","1970-01-01","2099-12-31"
"O03.37","O0337","Sepsis following incomplete spontaneous abortion","Sepsis following incomplete spontaneous abortion",45596899,"Sepsis following incomplete spontaneous abortion","Condition","ICD10CM","5-char billing code","1970-01-01","2099-12-31"
"O03.38","O0338","Urinary tract infection following incomplete spon abortion","Urinary tract infection following incomplete spontaneous abortion",45553466,"Urinary tract infection following incomplete spontaneous abortion","Condition","ICD10CM","5-char billing code","1970-01-01","2099-12-31"
"O03.39","O0339","Incomplete spontaneous abortion with other complications","Incomplete spontaneous abortion with other complications",45563038,"Incomplete spontaneous abortion with other complications","Condition","ICD10CM","5-char billing code","1970-01-01","2099-12-31"
"O03.4","O034","Incomplete spontaneous abortion without complication","Incomplete spontaneous abortion without complication",35209528,"Incomplete spontaneous abortion without complication","Condition","ICD10CM","4-char billing code","2007-01-01","2099-12-31"
"O03.5","O035","Genitl trct and pelvic infct fol complete or unsp spon abort","Genital tract and pelvic infection following complete or unspecified spontaneous abortion",35209529,"Genital tract and pelvic infection following complete or unspecified spontaneous abortion","Condition","ICD10CM","4-char billing code","2007-01-01","2099-12-31"
"O03.6","O036","Delayed or excess hemor fol complete or unsp spon abortion","Delayed or excessive hemorrhage following complete or unspecified spontaneous abortion",35209530,"Delayed or excessive hemorrhage following complete or unspecified spontaneous abortion","Condition","ICD10CM","4-char billing code","2007-01-01","2099-12-31"
"O03.7","O037","Embolism following complete or unsp spontaneous abortion","Embolism following complete or unspecified spontaneous abortion",35209531,"Embolism following complete or unspecified spontaneous abortion","Condition","ICD10CM","4-char billing code","2007-01-01","2099-12-31"
"O03.8",NA,NA,NA,1571607,"Other and unspecified complications following complete or unspecified spontaneous abortion","Condition","ICD10CM","4-char nonbill code","2012-01-01","2099-12-31"
"O03.80","O0380","Unsp comp following complete or unsp spontaneous abortion","Unspecified complication following complete or unspecified spontaneous abortion",45548688,"Unspecified complication following complete or unspecified spontaneous abortion","Condition","ICD10CM","5-char billing code","1970-01-01","2099-12-31"
"O03.81","O0381","Shock following complete or unspecified spontaneous abortion","Shock following complete or unspecified spontaneous abortion",45563039,"Shock following complete or unspecified spontaneous abortion","Condition","ICD10CM","5-char billing code","1970-01-01","2099-12-31"
"O03.82","O0382","Renal failure following complete or unsp spon abortion","Renal failure following complete or unspecified spontaneous abortion",45592173,"Renal failure following complete or unspecified spontaneous abortion","Condition","ICD10CM","5-char billing code","1970-01-01","2099-12-31"
"O03.83","O0383","Metabolic disorder following complete or unsp spon abortion","Metabolic disorder following complete or unspecified spontaneous abortion",45548689,"Metabolic disorder following complete or unspecified spontaneous abortion","Condition","ICD10CM","5-char billing code","1970-01-01","2099-12-31"
"O03.84","O0384","Damage to pelvic organs fol complete or unsp spon abortion","Damage to pelvic organs following complete or unspecified spontaneous abortion",45572748,"Damage to pelvic organs following complete or unspecified spontaneous abortion","Condition","ICD10CM","5-char billing code","1970-01-01","2099-12-31"
"O03.85","O0385","Oth venous comp following complete or unsp spon abortion","Other venous complications following complete or unspecified spontaneous abortion",45567880,"Other venous complications following complete or unspecified spontaneous abortion","Condition","ICD10CM","5-char billing code","1970-01-01","2099-12-31"
"O03.86","O0386","Cardiac arrest following complete or unsp spon abortion","Cardiac arrest following complete or unspecified spontaneous abortion",45587266,"Cardiac arrest following complete or unspecified spontaneous abortion","Condition","ICD10CM","5-char billing code","1970-01-01","2099-12-31"
"O03.87","O0387","Sepsis following complete or unsp spontaneous abortion","Sepsis following complete or unspecified spontaneous abortion",45601765,"Sepsis following complete or unspecified spontaneous abortion","Condition","ICD10CM","5-char billing code","1970-01-01","2099-12-31"
"O03.88","O0388","Urinary tract infection fol complete or unsp spon abortion","Urinary tract infection following complete or unspecified spontaneous abortion",45558186,"Urinary tract infection following complete or unspecified spontaneous abortion","Condition","ICD10CM","5-char billing code","1970-01-01","2099-12-31"
"O03.89","O0389","Complete or unsp spontaneous abortion with oth complications","Complete or unspecified spontaneous abortion with other complications",45572749,"Complete or unspecified spontaneous abortion with other complications","Condition","ICD10CM","5-char billing code","1970-01-01","2099-12-31"
"O03.9","O039","Complete or unsp spontaneous abortion without complication","Complete or unspecified spontaneous abortion without complication",35209532,"Complete or unspecified spontaneous abortion without complication","Condition","ICD10CM","4-char billing code","2007-01-01","2099-12-31"
"O04",NA,NA,NA,1571608,"Complications following (induced) termination of pregnancy","Condition","ICD10CM","3-char nonbill code","2012-01-01","2099-12-31"
"O04.5","O045","Genitl trct and pelvic infct fol (induced) term of pregnancy","Genital tract and pelvic infection following (induced) termination of pregnancy",35209533,"Genital tract and pelvic infection following (induced) termination of pregnancy","Condition","ICD10CM","4-char billing code","2007-01-01","2099-12-31"
"O04.6","O046","Delayed or excess hemor fol (induced) term of pregnancy","Delayed or excessive hemorrhage following (induced) termination of pregnancy",35209534,"Delayed or excessive hemorrhage following (induced) termination of pregnancy","Condition","ICD10CM","4-char billing code","2007-01-01","2099-12-31"
"O04.7","O047","Embolism following (induced) termination of pregnancy","Embolism following (induced) termination of pregnancy",35209535,"Embolism following (induced) termination of pregnancy","Condition","ICD10CM","4-char billing code","2007-01-01","2099-12-31"
"O04.8",NA,NA,NA,1571609,"(Induced) termination of pregnancy with other and unspecified complications","Condition","ICD10CM","4-char nonbill code","2012-01-01","2099-12-31"
"O04.80","O0480","(Induced) termination of pregnancy with unsp complications","(Induced) termination of pregnancy with unspecified complications",45539079,"(Induced) termination of pregnancy with unspecified complications","Condition","ICD10CM","5-char billing code","1970-01-01","2099-12-31"
"O04.81","O0481","Shock following (induced) termination of pregnancy","Shock following (induced) termination of pregnancy",45572750,"Shock following (induced) termination of pregnancy","Condition","ICD10CM","5-char billing code","1970-01-01","2099-12-31"
"O04.82","O0482","Renal failure following (induced) termination of pregnancy","Renal failure following (induced) termination of pregnancy",45558188,"Renal failure following (induced) termination of pregnancy","Condition","ICD10CM","5-char billing code","1970-01-01","2099-12-31"
"O04.83","O0483","Metabolic disorder following (induced) term of pregnancy","Metabolic disorder following (induced) termination of pregnancy",45543908,"Metabolic disorder following (induced) termination of pregnancy","Condition","ICD10CM","5-char billing code","1970-01-01","2099-12-31"
"O04.84","O0484","Damage to pelvic organs fol (induced) term of pregnancy","Damage to pelvic organs following (induced) termination of pregnancy",45548690,"Damage to pelvic organs following (induced) termination of pregnancy","Condition","ICD10CM","5-char billing code","1970-01-01","2099-12-31"
"O04.85","O0485","Oth venous comp following (induced) termination of pregnancy","Other venous complications following (induced) termination of pregnancy",45534157,"Other venous complications following (induced) termination of pregnancy","Condition","ICD10CM","5-char billing code","1970-01-01","2099-12-31"
"O04.86","O0486","Cardiac arrest following (induced) termination of pregnancy","Cardiac arrest following (induced) termination of pregnancy",45606530,"Cardiac arrest following (induced) termination of pregnancy","Condition","ICD10CM","5-char billing code","1970-01-01","2099-12-31"
"O04.87","O0487","Sepsis following (induced) termination of pregnancy","Sepsis following (induced) termination of pregnancy",45548691,"Sepsis following (induced) termination of pregnancy","Condition","ICD10CM","5-char billing code","1970-01-01","2099-12-31"
"O04.88","O0488","Urinary tract infection fol (induced) term of pregnancy","Urinary tract infection following (induced) termination of pregnancy",45582438,"Urinary tract infection following (induced) termination of pregnancy","Condition","ICD10CM","5-char billing code","1970-01-01","2099-12-31"
"O04.89","O0489","(Induced) termination of pregnancy with other complications","(Induced) termination of pregnancy with other complications",45587269,"(Induced) termination of pregnancy with other complications","Condition","ICD10CM","5-char billing code","1970-01-01","2099-12-31"
"O07",NA,NA,NA,1571610,"Failed attempted termination of pregnancy","Condition","ICD10CM","3-char nonbill code","2012-01-01","2099-12-31"
"O07.0","O070","Genitl trct and pelvic infct fol failed attempt term of preg","Genital tract and pelvic infection following failed attempted termination of pregnancy",35209536,"Genital tract and pelvic infection following failed attempted termination of pregnancy","Condition","ICD10CM","4-char billing code","2007-01-01","2099-12-31"
"O07.1","O071","Delayed or excess hemor fol failed attempt term of pregnancy","Delayed or excessive hemorrhage following failed attempted termination of pregnancy",35209537,"Delayed or excessive hemorrhage following failed attempted termination of pregnancy","Condition","ICD10CM","4-char billing code","2007-01-01","2099-12-31"
"O07.2","O072","Embolism following failed attempted termination of pregnancy","Embolism following failed attempted termination of pregnancy",35209538,"Embolism following failed attempted termination of pregnancy","Condition","ICD10CM","4-char billing code","2007-01-01","2099-12-31"
"O07.3",NA,NA,NA,1571611,"Failed attempted termination of pregnancy with other and unspecified complications","Condition","ICD10CM","4-char nonbill code","2012-01-01","2099-12-31"
"O07.30","O0730","Failed attempted termination of pregnancy w unsp comp","Failed attempted termination of pregnancy with unspecified complications",45553470,"Failed attempted termination of pregnancy with unspecified complications","Condition","ICD10CM","5-char billing code","1970-01-01","2099-12-31"
"O07.31","O0731","Shock following failed attempted termination of pregnancy","Shock following failed attempted termination of pregnancy",45577550,"Shock following failed attempted termination of pregnancy","Condition","ICD10CM","5-char billing code","1970-01-01","2099-12-31"
"O07.32","O0732","Renal failure following failed attempted term of pregnancy","Renal failure following failed attempted termination of pregnancy",45558190,"Renal failure following failed attempted termination of pregnancy","Condition","ICD10CM","5-char billing code","1970-01-01","2099-12-31"
"O07.33","O0733","Metabolic disorder fol failed attempt term of pregnancy","Metabolic disorder following failed attempted termination of pregnancy",45606532,"Metabolic disorder following failed attempted termination of pregnancy","Condition","ICD10CM","5-char billing code","1970-01-01","2099-12-31"
"O07.34","O0734","Damage to pelvic organs fol failed attempt term of pregnancy","Damage to pelvic organs following failed attempted termination of pregnancy",45577551,"Damage to pelvic organs following failed attempted termination of pregnancy","Condition","ICD10CM","5-char billing code","1970-01-01","2099-12-31"
"O07.35","O0735","Oth venous comp following failed attempted term of pregnancy","Other venous complications following failed attempted termination of pregnancy",45596907,"Other venous complications following failed attempted termination of pregnancy","Condition","ICD10CM","5-char billing code","1970-01-01","2099-12-31"
"O07.36","O0736","Cardiac arrest following failed attempted term of pregnancy","Cardiac arrest following failed attempted termination of pregnancy",45534161,"Cardiac arrest following failed attempted termination of pregnancy","Condition","ICD10CM","5-char billing code","1970-01-01","2099-12-31"
"O07.37","O0737","Sepsis following failed attempted termination of pregnancy","Sepsis following failed attempted termination of pregnancy",45534162,"Sepsis following failed attempted termination of pregnancy","Condition","ICD10CM","5-char billing code","1970-01-01","2099-12-31"
"O07.38","O0738","Urinary tract infection fol failed attempt term of pregnancy","Urinary tract infection following failed attempted termination of pregnancy",45601770,"Urinary tract infection following failed attempted termination of pregnancy","Condition","ICD10CM","5-char billing code","1970-01-01","2099-12-31"
"O07.39","O0739","Failed attempted termination of pregnancy w oth comp","Failed attempted termination of pregnancy with other complications",45572753,"Failed attempted termination of pregnancy with other complications","Condition","ICD10CM","5-char billing code","1970-01-01","2099-12-31"
